"","id","date","geo","lat","long","text"
"870","686883072332140544","2016-01-12 13:11:00","Paratinga, Brasil","-12.6924589","-43.1805317","A guria se acha tanto. Miga seje menas que até mosquito da dengue causa mais que você"
"868","686884969352970240","2016-01-12 13:18:33","Paraguay","-23.3165934","-58.1693444","Las primeras muertes por dengue se dieron en San Lorenzo y eso ya no queremos Albino Ferrer Int. de San Lorenzo #R800AM"
"867","686885185632223232","2016-01-12 13:19:24","Paraguay","-23.3165934","-58.1693444","Los sanlorenzanos están más concienciados. Los indices de dengue son menores Albino Ferrer Int. de San Lorenzo #R800AM"
"866","686886899387121664","2016-01-12 13:26:13","Uruguay","-32.8755547","-56.0201524","En Salto investigan un posible caso de dengue autóctono http://www. elpais.com.uy/informacion/de ngue-salto-aedes-aegypti-inundaciones-lima.html … pic.twitter.com/xNkSUCJStx"
"865","686888086345805826","2016-01-12 13:30:56","Paraguay","-23.3165934","-58.1693444","En este momento no tienen solo la culpa el intendente o concejales sobre el dengue  Sebastián Villarejo Concejal de Asunción #R800AM"
"864","686888661099610113","2016-01-12 13:33:13","Posadas, Argentina","-27.366486600000005","-55.893967599999996","#Dengue : Operativos martes y miércoles en zona de av San Martín Martín Fierro Monseñor de Andrea y Bustamante."
"863","686892011903971328","2016-01-12 13:46:32","João Pessoa, Brazil","-7.121598","-34.8820279","Reunião hoje no Sinduscon na capital vai debater o combate ao mosquito da dengue em canteiros de obras."
"862","686892068556435456","2016-01-12 13:46:45","São José dos Campos, Brasil","-23.180501","-45.8872968","Espero que eu não volte com dengue de Mairiporã de novo"
"861","686892556764987392","2016-01-12 13:48:42","Paranaguá, Brasil","-25.5121903","-48.5251853","So uma dengue  ta reepreedido"
"860","686894927981232128","2016-01-12 13:58:07","Vitória, Brazil","-20.2996825","-40.3016326","Vei to com dengue"
"858","686895992919187456","2016-01-12 14:02:21","Rio de Janeiro, Brazil","-22.911013600000004","-43.2093726","Na epidemia de dengue em 2002 aqui no Rio médicos relataram q mtos se intoxicaram com paracetamol... https:// twitter.com/maitabom/statu s/686881815261347840 …"
"857","686896523993575425","2016-01-12 14:04:27","Olinda, Brasil","-7.998639999999999","-34.845955100000005","Oq é pior chikungunya ou dengue ?"
"856","686899440116969472","2016-01-12 14:16:03","Paraguay","-23.3165934","-58.1693444","Desde exteriores @juanchovital habla de casos de dengue dentro de los Penales #R800AM"
"855","686899937456615424","2016-01-12 14:18:01","Paraguay","-23.3165934","-58.1693444","Cuando estaba en la dirección del penal solamente tuvimos dos casos de dengue  Artemio Barrios Dir. Institutos Penales @MJusticiaPy"
"854","686900383051026432","2016-01-12 14:19:47","Florianópolis, Brazil","-27.5973001","-48.5496097","Meu whats vai dar dengue . Misericordia"
"853","686902001301585920","2016-01-12 14:26:13","Paraguay","-23.3165934","-58.1693444","El estado climático es un factor negativo y ayuda a la propagación del dengue  Sen. @esperanza_py #R800AM"
"852","686902692636135424","2016-01-12 14:28:58","Porto Alegre, Brazil","-30.0329999","-51.2304999","@RemadorCopero @ismaaluz e a dengue ?"
"850","686903067237822464","2016-01-12 14:30:27","Paraguay","-23.3165934","-58.1693444","Además de las lluvias la falta de recolección de basura tampoco ayuda a evitar el dengue  Sen. @esperanza_py #R800AM"
"849","686903942136094720","2016-01-12 14:33:56","Araruama, Brasil","-22.8733202","-42.3428896","O moço da dengue vienheram aqui"
"848","686904787263188993","2016-01-12 14:37:18","Paraguay","-23.3165934","-58.1693444","El dengue es urbano está alojado en el jardín de tu casa Sen. @esperanza_py #R800AM"
"847","686905542317576192","2016-01-12 14:40:18","Cachoeiro de Itapemirim, Brasil","-20.8480839","-41.111289899999996","Só falta eu estar com dengue agora"
"846","686905693127966720","2016-01-12 14:40:53","Curitiba, Brazil","-25.429569600000004","-49.2712361","Sempre eu acho que tou com dengue"
"845","686905855934115840","2016-01-12 14:41:32","Paraguay","-23.3165934","-58.1693444","#AHORA : Coordinan acciones para minga ambiental San Pedro Eliminación de criaderos de #Dengue #Zika #Chikungunya pic.twitter.com/7xXzO74hfB"
"844","686906365634306048","2016-01-12 14:43:34","Curitiba, Brazil","-25.429569600000004","-49.2712361","Hoje por exemplo eu acho que tou com dengue"
"843","686909521663537152","2016-01-12 14:56:06","Contagem, Brasil","-19.913274800000003","-44.08409520000001","To com dengue"
"842","686912532108435456","2016-01-12 15:08:04","Betim, Brasil","-19.9680559","-44.1983329","Dengue e meu ovo soh"
"841","686913639341768705","2016-01-12 15:12:28","Sao Paulo, Brazil","-23.5506506","-46.6333823","minha cunhada está com dengue man oi?"
"840","686914598776213504","2016-01-12 15:16:17","Sao Paulo, Brazil","-23.5506506","-46.6333823","PR: segunda morte por dengue em Paranaguá é confirmada pela Saúde http:// glo.bo/1RJdafO #G1"
"836","686915685377781760","2016-01-12 15:20:36","Paraguay","-23.3165934","-58.1693444","Falta de prevención desencadenó epidemia de dengue http:// bit.ly/1N4PWdX pic.twitter.com/yyVchpXFyE"
"835","686916265978540032","2016-01-12 15:22:54","Paraguay","-23.3165934","-58.1693444","Un niño con sospecha de fiebre amarilla activa otra alerta en @msaludpy tras la declaración de epidemia por dengue . http:// lavozdigital.com.py/articulos/leer /2894-amenaza-de-fiebre-amarilla-se-suma-al-dengue.html …"
"834","686918332407218177","2016-01-12 15:31:07","Caazapa, Paraguay","-26.1963889","-56.36552","Increíble que en plena epidemia de dengue la basura no se tira en caazapa desde hace más de 1 mes! ! Y que dicen en la muni?"
"833","686918386387922944","2016-01-12 15:31:20","Paraguay","-23.3165934","-58.1693444","Lanzamiento Juntos contra el Dengue  Zica y Chicungunya allanamiento con fiscal del medio ambiente Dra. Ocampos pic.twitter.com/YRlNV9hP8g"
"832","686918673827819520","2016-01-12 15:32:28","Capão da Canoa, Brasil","-29.7542936","-50.0215683","Esse mimimimi de dengue é apenas porque algum vizinho ou você mesmo é um porco relaxado."
"831","686925335133290497","2016-01-12 15:58:57","Rio das Ostras, Brasil","-22.526944699999998","-41.9449719","Muita gente pegando dengue"
"830","686926946618503169","2016-01-12 16:05:21","Encarnacion, Paraguay","-27.3385815","-55.8668455","Vamos que a limpiar los patios!! Dejen de ser puercos!! Morir de Dengue es tan estúpido si se puede evitar"
"829","686927797244309505","2016-01-12 16:08:44","Corrientes, Argentina","-27.472034100000002","-58.8328657","MINISTRO DE SALUD Siete casos de dengue confirmados: Hay que extremar los cuidados http://www. radiosudamericana.com/notix/nota/139 916_siete_casos_de_dengue_confirmados_hay_que_extremar_los_cuidados.htm … pic.twitter.com/XstxT8c5J2"
"828","686927988802371585","2016-01-12 16:09:29","Central, Paraguay","-25.4999999","-57.49999989999999","Dengue gua'u (@Romina's House) https://www. swarmapp.com/c/linaNIcfIGn"
"827","686928045773565953","2016-01-12 16:09:43","Central, Paraguay","-25.4999999","-57.49999989999999","Dengue gua'u (@Romina's House) https://www. swarmapp.com/brauliosamuel/ checkin/56951729498e4de308878e8f?s=yGMH6oEZ_-P2QodhxYJ6ShX9d7M&ref=tw …"
"826","686929507194933249","2016-01-12 16:15:31","Rio de Janeiro, Brazil","-22.911013600000004","-43.2093726","Nunca tive caxumba nunca tive dengue  nunca tive conjuntivite nunca tive catapora... Me sinto um alien."
"825","686929844135964672","2016-01-12 16:16:52","Recife, Brazil","-8.064193","-34.8781516","As dores nas articulações estão voltando  será que peguei dengue novamente ou não me curei da mesma."
"824","686930325990195201","2016-01-12 16:18:46","Rio de Janeiro, Brazil","-22.911013600000004","-43.2093726"," @g1 : PR: segunda morte por dengue em Paranaguá é confirmada pela Saúde http:// glo.bo/1RJdafO #G1 pic.twitter.com/BTkzBmr9z5 "
"823","686931595215900672","2016-01-12 16:23:49","Goiânia, Brazil","-16.680881900000003","-49.253269","vejo foto de mosquito da dengue na TL em notícias desses portais e começo a me coçar a tentar matar mosquito imaginário"
"821","686933245854900224","2016-01-12 16:30:23","Paraguay","-23.3165934","-58.1693444","El dengue esta y seguira matando gente es la cultura puerca que tenemos hasta que no asuman... que la plaga viene de tu puerquesa. saludis"
"820","686935466000674816","2016-01-12 16:39:12","Volta Redonda, Brasil","-22.5225496","-44.104012700000006","Marcelo Castro ministro da saúde conhecem??? Disse que vacinar o brasileiro contra a dengue fica caro 30000 por pessoa. Vai vendo.."
"819","686935966582452224","2016-01-12 16:41:11","Rio de Janeiro, Brazil","-22.911013600000004","-43.2093726","Dengue @Sala de Observação - Unimed - Rio https://www. instagram.com/p/BAccAR3Eg-O/"
"818","686935981036056576","2016-01-12 16:41:15","Paranaguá, Brasil","-25.5121903","-48.5251853","To cabreiro com essa porra de dengue"
"817","686938725293682688","2016-01-12 16:52:09","Paranaguá, Brasil","-25.5121903","-48.5251853","quem já nadou no rio itibere ou no rocioe sobreviveu é imune ao mosquito da dengue e o zika vírus"
"814","686940722252091392","2016-01-12 17:00:05","Raposos, Brasil","-19.9672229","-43.8041669","Meu love ta c suspeita de dengue :("
"813","686941739228262401","2016-01-12 17:04:08","Brasília, Brazil","-10.3333332","-53.199999899999995","@RainhaXgg Calma podia ser pior. Podia ser aquela industria (do RJ acho) que está com 75% do quadro de atestado por causa da dengue ."
"812","686942501010292736","2016-01-12 17:07:09","Posadas, Argentina","-27.366486600000005","-55.893967599999996","Mi vecino tiene dengue"
"811","686945854209548288","2016-01-12 17:20:29","Central, Paraguay","-25.4999999","-57.49999989999999","La guerra contra el dengue se gana en las calles http://www. sanlorenzopy.com/34793/la-guerr a-contra-el-dengue-se-gana-en-las-calles/ …"
"809","686949117709402112","2016-01-12 17:33:27","Central, Paraguay","-25.4999999","-57.49999989999999","Si me agarra dengue por 5ta vez pos no espero sobrevivir"
"808","686950127488102402","2016-01-12 17:37:27","Cruzeiro da Fortaleza, Brasil","-18.9466659","-46.673888899999994","Thiago namorado dela ta com dengue diz ela"
"806","686951652176326656","2016-01-12 17:43:31","Ribeirão Preto, Brasil","-21.1783329","-47.806667","orando pra que nenhum desses demônio tenha dengue"
"805","686952569122484224","2016-01-12 17:47:10","Uruguay","-32.8755547","-56.0201524","El Ministerio de Salud espera el resultado de un posible caso de dengue en Salto. pic.twitter.com/CwIGNwT3lA"
"804","686953574383878144","2016-01-12 17:51:09","Vitória, Brazil","-20.2996825","-40.3016326","To com dengue e infecção da urina"
"802","686958251657805824","2016-01-12 18:09:44","Rio de Janeiro, Brazil","-22.911013600000004","-43.2093726","não seja dengue aleluia #BieberBestFans2016"
"800","686960492636692481","2016-01-12 18:18:39","Além Paraíba, Brasil","-21.8760575","-42.6810472","Estou com suspeita d dengue"
"799","686960932510105600","2016-01-12 18:20:24","Rio de Janeiro, Brazil","-22.911013600000004","-43.2093726","O amanhã vai ter umas dengue e sujeira não vai ligar muito pra arte mas tudo bem porque é… https://www. instagram.com/p/BAcnhzZnrke/"
"797","686964651318460416","2016-01-12 18:35:10","Campinas, Brasil","-22.9055599","-47.0608299","E quanto sai por dia o doente com dengue ? https:// twitter.com/moniquecheker/ status/686846880614080512 …"
"796","686965328627286016","2016-01-12 18:37:52","Paraguay","-23.3165934","-58.1693444","Hay aumento de pacientes febriles pero en Urgencias vienen casos con otras patología. Casos de dengue son evaluados Dr. Jorge Yubi #780AM"
"795","686965743120957440","2016-01-12 18:39:31","Paraguay","-23.3165934","-58.1693444","Hasta el lunes tenemos internados 22 pacientes por #dengue  15 son adultos Dr. Jorge Yubi Hospital de Clínicas #780AM"
"794","686966215546421248","2016-01-12 18:41:23","Juiz de Fora, Brasil","-21.7609532","-43.3501128","@unimedbh ontem já em JDF fiz novo exame e foi confirmado positivo pra Dengue ."
"792","686969404425371648","2016-01-12 18:54:03","Maceió, Brazil","-9.647684199999999","-35.7339263","Sem controle a dengue e a zica se alastram em aéreas públicas da Capital de Alagoas! pic.twitter.com/zg2MFhDoqS"
"790","686971778141405184","2016-01-12 19:03:29","Posadas, Argentina","-27.366486600000005","-55.893967599999996","todos contra el dengue"
"789","686974708596740096","2016-01-12 19:15:08","Central, Paraguay","-25.4999999","-57.49999989999999","Yo creo que odio el verano pero de Paraguay nomas ya que es la época en que hay más casos de dengue y toda la mierda lagos contaminados"
"788","686976038899978240","2016-01-12 19:20:25","Brasília, Brazil","-10.3333332","-53.199999899999995","Minhas ferias ta tão parada que jaja da dengue"
"786","686977877875752962","2016-01-12 19:27:44","Formosa, Argentina","-24.5955305","-60.428971700000005","Que calor la concha del dengue"
"785","686978437945360384","2016-01-12 19:29:57","Resistencia, Argentina","-27.451104200000003","-58.9865645","Stalkeo a cada dengueee jaja más dengue soy yo"
"784","686979108778176517","2016-01-12 19:32:37","Pontal do Paraná, Brasil","-25.6735329","-48.5110619","Alguém sabe os sintomas da dengue ?"
"782","686981023276642304","2016-01-12 19:40:14","Curitiba, Brazil","-25.429569600000004","-49.2712361","SAÚDE:Paranaguáno litoral do PRconfirma a segunda morte por dengue http://www. parana-online.com.br/editoria/cidad es/news/928021/?noticia=PARANAGUA+CONFIRMA+A+SEGUNDA+MORTE+POR+DENGUE … pic.twitter.com/rkKi0gCU6t"
"780","686983325131640833","2016-01-12 19:49:22","Niterói, Brasil","-22.883237","-43.115455100000005","cara tem muita gente pegando zica já peguei dengue e fiquei morta na cama imagina a zica ta ninguém perguntou mas falo mesmo assim"
"779","686984495573110784","2016-01-12 19:54:01","Sao Paulo, Brazil","-23.5506506","-46.6333823","A @anvisa_oficial registrou a 1ª vacina contra a dengue . Confira: https:// goo.gl/5yPXRH #TVSaúde #CombateAedes"
"778","686984930732195840","2016-01-12 19:55:45","Rio de Janeiro, Brazil","-22.911013600000004","-43.2093726","Só hoje o MPERJ mandou uma recomendação com referência à dengue e ao zika vírus"
"777","686985525073440769","2016-01-12 19:58:07","Paraguay","-23.3165934","-58.1693444","Estamos con bastantes casos notificados de dengue  Dra. Claudia Liuzzi Directora de la II Región Sanitaria #R800AM"
"776","686986610416730117","2016-01-12 20:02:26","Curitiba, Brazil","-25.429569600000004","-49.2712361","LITORAL DO PARANÁ:Paranaguá adia Carnaval por conta da epidemia de dengue http://www. parana-online.com.br/editoria/cidad es/news/928007/?noticia=PARANAGUA+ADIA+CARNAVAL+POR+CONTA+DA+EPIDEMIA+DE+DENGUE … pic.twitter.com/0WGNXtYYoN"
"775","686987422320726016","2016-01-12 20:05:39","Paraguay","-23.3165934","-58.1693444","En el caso del dengue lo que se hace es el tratamiento sintomático Dra. Claudia Liuzzi II Región Sanitaria #R800AM"
"774","686987675983851520","2016-01-12 20:06:40","Paraguay","-23.3165934","-58.1693444","El tratamiento para el dengue es muy específico Dra. Claudia Liuzzi Directora de la II Región Sanitaria #R800AM"
"773","686988101521162240","2016-01-12 20:08:21","Paranaguá, Brasil","-25.5121903","-48.5251853","Estou com medo dessa dengue"
"772","686989011454394368","2016-01-12 20:11:58","Osasco, Brasil","-23.5324858","-46.79168","A @anvisa_oficial registrou a 1ª vacina contra a dengue . Confira: https:// goo.gl/5yPXRH #TVSaúde #CombateAedes"
"770","686992860525293569","2016-01-12 20:27:16","Curitiba, Brazil","-25.429569600000004","-49.2712361","Voltei sem dengue"
"769","686993396339191809","2016-01-12 20:29:24","Brasília, Brazil","-10.3333332","-53.199999899999995","Só pode regram @hqsc Em época de dengue MATEI TUDOOOOO #humor @Guará City https://www. instagram.com/p/BAc2SmOqcKS/"
"768","686995617042796549","2016-01-12 20:38:13","Goiatuba, Brasil","-18.0154576","-49.364059000000005","Nossa que corpo ruim acho que e gripe. Só não pode ser dengue"
"767","686997817026560001","2016-01-12 20:46:58","Paranaguá, Brasil","-25.5121903","-48.5251853","Até com dengue eu não perco o humor"
"765","687003308846891009","2016-01-12 21:08:47","Corrientes, Argentina","-27.472034100000002","-58.8328657","Me picaron mil mosquitos seguro ya tengo dengue ."
"764","687004301902876672","2016-01-12 21:12:44","Teresópolis, Brasil","-22.4164577","-42.9751939","Saúde confirma sete casos de dengue em Teresópolis http:// netdiario.com.br/?p=41163 pic.twitter.com/6KskVUoZGz"
"763","687005493068435456","2016-01-12 21:17:28","São Luís, Brazil","-2.5319222999999997","-44.293327500000004","Cachorro pode pegar dengue ? leia: http://www. tvguara.com pic.twitter.com/yeDZgbUIqw"
"761","687009267149324288","2016-01-12 21:32:27","Ibitinga, Brasil","-21.7562299","-48.831902899999996","Fui buscar o exame da dengue  nao deu nada"
"759","687012207293521921","2016-01-12 21:44:08","Sao Paulo, Brazil","-23.5506506","-46.6333823","se um dia eu morrer de dengue estejam avidados que: pic.twitter.com/o4HJRPPVcK"
"758","687012643446616064","2016-01-12 21:45:52","La Florida, Chile","-33.53071435","-70.54402705938959"," @T13 : Así es el mosquito que causa el zika el dengue y la chikungunya » http:// bit.ly/1SMXfOy  ¡qué belleza! ¡al miss universo!"
"757","687013113997049856","2016-01-12 21:47:45","Campo Grande, Brazil","-20.4640172","-54.616294599999996","Meus bisas de 77 anos meu vô fez cirurgia do olho e minha vó parece ta com dengue"
"756","687013445980520448","2016-01-12 21:49:04","Serra, Brasil","-20.125296","-40.306447600000006","Como assim tem gente contra vacina? No momento o que eu mais quero é me vacinar contra dengue  não quero mais sofrer. ç.ç"
"755","687013682841305088","2016-01-12 21:50:00","Serra, Brasil","-20.125296","-40.306447600000006","@Ironia_Sama Já tive dengue duas vezes tenho medo da hemorrágica."
"754","687014755555512322","2016-01-12 21:54:16","Carmo de Minas, Brasil","-22.121665399999998","-45.1323835","Combatam a Dengue se o mosquito mata ele não pode nascer"
"753","687017018973896705","2016-01-12 22:03:16","São Luís, Brazil","-2.5319222999999997","-44.293327500000004","Cientistas criam vagina contra dengue"
"752","687017837869821954","2016-01-12 22:06:31","Belo Horizonte, Brazil","-19.922731699999996","-43.945094700000006","@nasciviciado alguma infecção ou dengue .. febre xijfghfhgfjnha kkk"
"751","687019499229458433","2016-01-12 22:13:07","Santa Fe, Argentina","-31.64727895","-60.6430356770138","Continúa la campaña de limpieza y anti dengue por los barrios santotomeños http:// municipalidadstome.com.ar/continua-la-ca mpana-de-limpieza-y-anti-dengue-por-los-barrios-santotomenos/ … pic.twitter.com/7ilS6Na9sC"
"750","687019717383589889","2016-01-12 22:13:59","Santa Fe, Argentina","-31.64727895","-60.6430356770138","Continúa la campaña de limpieza y anti dengue por los barrios santotomeños http:// municipalidadstome.com.ar/continua-la-ca mpana-de-limpieza-y-anti-dengue-por-los-barrios-santotomenos/ … pic.twitter.com/EUR4AJYTg7"
"749","687019931783802881","2016-01-12 22:14:50","Santa Fe, Argentina","-31.64727895","-60.6430356770138","Continúa la campaña de limpieza y anti dengue por los barrios santotomeños http:// municipalidadstome.com.ar/continua-la-ca mpana-de-limpieza-y-anti-dengue-por-los-barrios-santotomenos/ … pic.twitter.com/2fq11IBKHn"
"748","687021111897387009","2016-01-12 22:19:31","Guidoval, Brasil","-21.1514476","-42.799715","Cansei dessa dengue já"
"747","687022358482255872","2016-01-12 22:24:29","Sao Paulo, Brazil","-23.5506506","-46.6333823","O CENTRO TEM ALTO RISCO DE DENGUE SCRR"
"746","687022911757127681","2016-01-12 22:26:41","Formosa, Argentina","-24.5955305","-60.428971700000005","Refsa hdp acuerdense que hay gente con dengue y fiebre me voy a morir de deshidratacion quieroo luz!!"
"745","687023293761753088","2016-01-12 22:28:12","Sao Paulo, Brazil","-23.5506506","-46.6333823","Quanto mais calor e mais sujeira o mosquito da dengue se reproduz ainda mais! Parabéns amantes do Verão"
"744","687023430764486658","2016-01-12 22:28:44","Minas Gerais, Brazil","-18.5264843","-44.1588653","Óooohh Santa Luzia cuidado com a dengue !!! @Guihamacek pic.twitter.com/jtTsEt3ix9"
"743","687023718527295489","2016-01-12 22:29:53","Concórdia, Brasil","-27.2314097","-52.02298029999999","Acho q to com dengue KKKKKKKK"
"742","687023984513298434","2016-01-12 22:30:56","Sao Paulo, Brazil","-23.5506506","-46.6333823","Fulano mora na PQP e vem meter o bedelho na polícia de SP! Ahhh vai cuidar da dengue no seu Estado"
"741","687024528971677696","2016-01-12 22:33:06","Sant'Ana do Livramento, Brasil","-30.8894096","-55.5317693","A imagem não tá muito boa mas será o mosquito da dengue ? pic.twitter.com/usyGpDvpsg"
"739","687026893909024770","2016-01-12 22:42:30","Belo Horizonte, Brazil","-19.922731699999996","-43.945094700000006","Estou com tanto álcool no organismo que se o mosquito da dengue me picar morre de cirrose !"
"738","687028161922613248","2016-01-12 22:47:32","Paranaguá, Brasil","-25.5121903","-48.5251853","500 e poucas pessoas com dengue nessa cidade ta loco"
"736","687028393041379328","2016-01-12 22:48:27","Pontal do Paraná, Brasil","-25.6735329","-48.5110619","@vinefrazeto dengue"
"735","687031553923379204","2016-01-12 23:01:01","Paranaguá, Brasil","-25.5121903","-48.5251853","Meu irmão ta com dengue"
"734","687032674297446400","2016-01-12 23:05:28","Cariacica, Brasil","-20.2632019","-40.4165489","Aposto que isso é dengue"
"733","687035619776790529","2016-01-12 23:17:10","Além Paraíba, Brasil","-21.8760575","-42.6810472","Todo mundo achando que tá com dengue pqp"
"732","687036060220657664","2016-01-12 23:18:55","Belford Roxo, Brasil","-22.7667283","-43.4033602","Gui ta com dengue"
"731","687036972246953984","2016-01-12 23:22:33","Maringá, Brasil","-23.425104","-51.938284499999995","nossa gnt vou voltar p foz c dengue"
"730","687038672684859392","2016-01-12 23:29:18","Cabo Frio, Brasil","-22.880436800000002","-42.0189226","Meu wifi tá com dengue kkkkkkk"
"729","687038853249667072","2016-01-12 23:30:01","Paranaguá, Brasil","-25.5121903","-48.5251853","4 pessoas com dengue no bairro. Se eu pegar fodeu"
"726","687043699365298176","2016-01-12 23:49:17","Recife, Brazil","-8.064193","-34.8781516","Eu com dengue e bob marketing sempre ao meu lado @Cazuzas House https://www. instagram.com/p/BAdNKkfKtcV/"
"725","687043977225310208","2016-01-12 23:50:23","San Miguel de Tucumán, Argentina","-26.847439299999998","-65.2259153938646","Che a ponerse OFF por las dudas! Una muerte por dengue en FOZ DE IGUAZU"
"724","687046449402626049","2016-01-13 00:00:12","Paranaguá, Brasil","-25.5121903","-48.5251853","Minha mãe com medo que eu esteja com dengue"
"723","687046765917372417","2016-01-13 00:01:28","Paraguay","-23.3165934","-58.1693444","Hospital de #VillaElisa recibe 400 consultas diarias por presuntos casos de Dengue #TelediarioPy pic.twitter.com/MSuty7UrrF"
"722","687046933391773696","2016-01-13 00:02:08","Além Paraíba, Brasil","-21.8760575","-42.6810472","Acho q n estou com dengue pq a Thaissa e o Willon quando tiveram desmaiaram lerda do jeito q eu sou já era pra ter dito uns 10 desmaios"
"719","687048126692220929","2016-01-13 00:06:52","Sao Paulo, Brazil","-23.5506506","-46.6333823","- bora dá aquela movimentada no whats porq whats parado também dá dengue  chamaa (11) 99546-3962"
"718","687048314697707520","2016-01-13 00:07:37","Central, Paraguay","-25.4999999","-57.49999989999999","Y bueno. .al dengue también se lo conoce como FIEBRE QUEBRANTA HUESOS. NO SERÁ por fracturas pero algo hay https:// twitter.com/rpcpy/status/6 87044502348017664 …"
"717","687048355508285442","2016-01-13 00:07:47","Paraguay","-23.3165934","-58.1693444","Alerta por dengue en #AltoParaná  inician mingas ambientales por 30 días #TelediarioPy pic.twitter.com/fuC8Komibd"
"715","687050219079495680","2016-01-13 00:15:11","Rio de Janeiro, Brazil","-22.911013600000004","-43.2093726","esses mlk ah qria uma dessa pra mim para q tu num pega nem dengue e me vem com essa"
"714","687050593089761284","2016-01-13 00:16:40","Santos, Brasil","-23.9608329","-46.3338889","@zemarinho_ aí desculpa migs eu peguei dengue aí"
"713","687054870831083520","2016-01-13 00:33:40","Recife, Brazil","-8.064193","-34.8781516","Quando eu tenho uma melhora da dengue  pego um resfriado daqueles! Or te Dana..."
"712","687055077199245312","2016-01-13 00:34:29","Formosa, Argentina","-24.5955305","-60.428971700000005","Este verano mi conquista fue el dengue !!"
"711","687055307969789953","2016-01-13 00:35:24","Paraguay","-23.3165934","-58.1693444","JAÚMINA -Pero hay dengue kpé Vamo a calmarno pic.twitter.com/EhBSPhDvQw"
"710","687056109178372096","2016-01-13 00:38:35","Guarulhos, Brasil","-23.443060100000004","-46.5244589","@NicolasFonteles @lauracva_ @EfremAzevedo Quem dera neah meu Whats é mais parado que água de dengue"
"709","687057547673661440","2016-01-13 00:44:18","Ribeirão Preto, Brasil","-21.1783329","-47.806667","@coffyney ahhhhh isso sim como não gostar hahaha só espero que não seja dengue"
"706","687261893040422913","2016-01-13 14:16:18","Ponta Pora, Paraguay","-25.334216","-57.483642200000006","Informe Xlll región sanatoria #Amambay casos de Dengue en los 5 distritos @94_9americafm pic.twitter.com/MATIZGBWTy"
"703","687267253977509889","2016-01-13 14:37:36","Bauru, Brasil","-22.321810100000004","-49.0705862","Dengue  Zika Chikungunya Microcefalia é o retrato do país onde a Saúde Pública e os governantes são piores que as larvas do Aedes Aegypti"
"702","687268853584388096","2016-01-13 14:43:58","Recife, Brazil","-8.064193","-34.8781516","Oh mosquito miserável... #dengue #bemestar"
