"","id","date","geo","lat","long","text"
"1206","683449956305252353","2016-01-03 01:49:02","Valparaíso de Goiás, Brasil","-16.09899","-47.98813","meu wpp parece água da dengue"
"1205","683463228102422528","2016-01-03 02:41:46","Armação dos Búzios, Brasil","-22.771","-41.9629","Cara to com suspeita de dengue em pleno dia 02 de janeiro . Começo de ano oh"
"1202","683474653696897025","2016-01-03 03:27:10","Araruama, Brasil","-22.87278","-42.343059999999994","Fora que vou sair daqui com zica e dengue provavelmente"
"1201","683475891075289088","2016-01-03 03:32:05","Serra, Brasil","-23.62611","-46.79167","Minha pagina ta tão parada que to com medo de dar dengue ."
"1200","683476268449402880","2016-01-03 03:33:35","Ibiúna, Brasil","-23.83577","-47.21076","@_hiwilson é dengue"
"1198","683493503092011008","2016-01-03 04:42:04","Mogi das Cruzes, Brasil","-23.522779999999997","-46.18833","meu whats ta mais parado q água de dengue"
"1197","683494905851822080","2016-01-03 04:47:38","São João del Rei, Brasil","-21.13556","-44.26167","Todos contra a dengue e o maldito mosquito! https:// twitter.com/jb5estrelas/st atus/683494799119355905 …"
"1196","683498505726504960","2016-01-03 05:01:57","Curitiba, Brazil","-25.42778","-49.27306","Lanna/Lana: Cuidado pra não deixar parar água nesses pneus pode criar dengue"
"1192","683506936915079168","2016-01-03 05:35:27","Brazil","-10.0","-55.0","@carlise_ pegar dengue ainda"
"1191","683507973126287360","2016-01-03 05:39:34","Porto Seguro, Brasil","-16.449720000000003","-39.06472","@_Lucasgsf que isso sô que bad. Eu tive dengue tb mas era novinha pakas tinha uns 8 anos. Sofri viu nu 1 semana de cama"
"1189","683515875064954881","2016-01-03 06:10:58","Nova Iguaçu, Brasil","-22.75917","-43.45111","Meu whats vai dar dengue  muito parado"
"1188","683516913348132864","2016-01-03 06:15:05","Sao Paulo, Brazil","-23.5475","-46.636109999999995","eu sou picada por insetos toda hora se for mosquito da dengue já morri"
"1186","683521231669297154","2016-01-03 06:32:15","Rio de Janeiro, Brazil","-22.90278","-43.2075","tml mais parada que água com foco de dengue"
"1185","683525017917886464","2016-01-03 06:47:18","Recife, Brazil","-8.053889999999999","-34.88111","A parada da dengue tá foda por aqui"
"1184","683528522980278272","2016-01-03 07:01:13","Indaiatuba, Brasil","-23.088420000000003","-47.2119","DENGUE NÃO É LEGAL :/"
"1182","683541801727299584","2016-01-03 07:53:59","Rio de Janeiro, Brazil","-22.90278","-43.2075","@AnaClaradosAnj8 melhoras e para de graça cr vai sim pode ser dengue cr vai no médico amor"
"1180","683564899344236544","2016-01-03 09:25:46","Londrina, Brasil","-23.31028","-51.16278","A dengue me pica em MS. Fez efeito em SC. E sou atendido em PR."
"1177","683574584373809152","2016-01-03 10:04:15","Sao Paulo, Brazil","-23.5475","-46.636109999999995","Brilliant ~ dengue huge in Brazil too https:// twitter.com/duffygary/stat us/683573906897301504 …"
"1173","683606861204090881","2016-01-03 12:12:31","Muriaé, Brasil","-21.13056","-42.36639","Mano disse que 2016 ia ser um lixoooooooo eu to com dengue em pleno dia 3 de janeiro de 20166666666"
"1171","683616605591441408","2016-01-03 12:51:14","Rio de Janeiro, Brazil","-22.90278","-43.2075","A culpa é da Dengue  micro X não combina com droga ma nutrição bebida liberada infecções ou uso virais.A prevenção nas casas bairros.."
"1169","683629462894817280","2016-01-03 13:42:19","São Luís, Brazil","-2.52972","-44.30278","Faz um mês que to com o vírus da dengue .. Não sei mais o que eu faço."
"1167","683647009820119040","2016-01-03 14:52:03","Volta Redonda, Brasil","-22.52306","-44.10417","Tive um sonho maluco onde eu estava com dengue . Chuta que é macumba!"
"1166","683648928802324481","2016-01-03 14:59:40","Indaiatuba, Brasil","-23.088420000000003","-47.2119","@nathborquezan to bem mal miga pelos exames e os meus sintomas tudo indica dengue :/"
"1165","683648940177256448","2016-01-03 14:59:43","Divinópolis, Brasil","-20.14355","-44.89065","eu devo ter emagrecido uns 450 kg por causa dessa porra de dengue"
"1163","683650479973339136","2016-01-03 15:05:50","Lagoa Santa, Brasil","-19.63006","-43.9009","@STKRTheMythical ontem foi dengue ?"
"1162","683651063220715520","2016-01-03 15:08:09","Pirapetinga, Brasil","-21.66797","-42.36515","Acho que minha mãe tá com dengue"
"1161","683652391539970048","2016-01-03 15:13:26","Rio de Janeiro, Brazil","-22.90278","-43.2075","@GPronaldo13 @luis_lago2002 Usem o mesmo método que estão fazendo com o mosquito da dengue : não deixa nascer."
"1160","683652686764466177","2016-01-03 15:14:36","Sao Paulo, Brazil","-23.5475","-46.636109999999995","Retrospectiva de 2015: Abril: Peguei dengue"
"1158","683657825269202944","2016-01-03 15:35:01","Rio de Janeiro, Brazil","-22.90278","-43.2075","Lipo de pobre é dengue ."
"1157","683660015538929664","2016-01-03 15:43:44","Bariri, Brasil","-22.07444","-48.74028","Com dengue https:// twitter.com/cleytu/status/ 683018942898671618 …"
"1156","683661711593848833","2016-01-03 15:50:28","Brasília, Brazil","-10.0","-55.0","Minha mãe tá achando que eu to com dengue"
"1155","683664488512503808","2016-01-03 16:01:30","Canoas, Brasil","-29.91778","-51.183609999999994","@GusLanzetta @estebantavares eu atualmente só pego dengue mesmo"
"1152","683685042510512135","2016-01-03 17:23:11","Serra, Brasil","-23.62611","-46.79167","Pra mim os jurados do The Voice Kids tinham que ser: • Chiquinho • Melocon • Praga & Dengue"
"1151","683689046716092416","2016-01-03 17:39:05","Brazil","-10.0","-55.0","Dizem que na piscina do Cucko ontem dengue era mato. #ÁguaImunda"
"1150","683691476828745728","2016-01-03 17:48:45","Pompéia, Brasil","-22.04169","-50.201229999999995","Mano se eu peguei dengue dnv eu to morto dessa eu não passo sério"
"1147","683694372861440000","2016-01-03 18:00:15","Cabo Frio, Brasil","-22.88717","-42.02622","Estou com todos os sintomas de dengue"
"1145","683699242779676672","2016-01-03 18:19:36","Rio Negro, Brasil","-0.25484","-65.55119","Essa propaganda da dengue mds"
"1144","683701277814067201","2016-01-03 18:27:41","Brazil","-10.0","-55.0","@srahamacek viada to super gripada mole mas acho que não é dengue não é só gripe"
"1142","683703750389809153","2016-01-03 18:37:31","Divino das Laranjeiras, Brasil","-18.71237","-41.4916","Acho que to com dengue"
"1141","683703983014326272","2016-01-03 18:38:26","Brasília, Brazil","-10.0","-55.0","Tá mas e o mosquito da dengue ??"
"1140","683715733453455360","2016-01-03 19:25:08","Tocantins, Brasil","-10.5","-48.0","Nunca vi tanta gente com dengue em um lugar só"
"1137","683717954513596417","2016-01-03 19:33:57","Ipatinga, Brasil","-19.468329999999998","-42.53667","@AnaClaraZappi wpp vai da dengue"
"1134","683734184851030016","2016-01-03 20:38:27","Caaguazu, Paraguay","-25.2","-55.833330000000004","[Salud] Eliminación de #criaderos es la mejor vacuna contra el #Dengue que el país puede tener” #Clasica92"
"1133","683737509449302017","2016-01-03 20:51:40","Ipatinga, Brasil","-19.468329999999998","-42.53667","@EduardoAlves31 descobriu que é dengue ????"
"1131","683753736758505473","2016-01-03 21:56:09","Santo Tomé, Argentina","-28.25","-56.25","Feliz cumple dengue !! Pasala lindo!! @HerreroJuani"
"1130","683759272296079361","2016-01-03 22:18:08","Posadas, Argentina","-27.367079999999998","-55.896080000000005","Todo el mundo se fue a Py. No vengan con Dengue ! Forros!"
"1129","683764471207227392","2016-01-03 22:38:48","Puerto Iguazú, Argentina","-25.599120000000003","-54.57355","Tengo miedo del dengue"
"1128","683766681353715714","2016-01-03 22:47:35","Asuncion, Paraguay","-25.30066","-57.635909999999996","@AsuDsu @Ferreiromario1 @nanduti @LaUnionAM800 Estamos todos con DENGUE EN LA CUADRA x favor necesitamos fumigacion y q recojan las basuras"
"1126","683768738877947904","2016-01-03 22:55:45","Posadas, Argentina","-27.367079999999998","-55.896080000000005","Con el tema del dengue me volvi mega paranoica u.u"
"1124","683769367289565188","2016-01-03 22:58:15","Belém, Brazil","-1.45583","-48.50444","PREFIRO O PUBLICO DO SS5 ESSE DA QUINTA PARECE A MARTA CRUZ PARECE Q TEM TUDO DENGUE"
"1123","683769701818826752","2016-01-03 22:59:35","Posadas, Argentina","-27.367079999999998","-55.896080000000005","Mi familia está traumada con el Dengue jajajaja"
"1122","683770357237583873","2016-01-03 23:02:11","Puerto Iguazú, Argentina","-25.599120000000003","-54.57355","Juitaua casi todo mi barrio tiene dengue"
"1120","683774157771935744","2016-01-03 23:17:17","Arapongas, Brasil","-23.419439999999998","-51.424440000000004","@tiponath pega dengue igual eu e depois faz uma prova no lugar do seminario"
"1119","683782325281402880","2016-01-03 23:49:45","Paraíba, Brazil","-7.25","-36.5","#DEDETIZADORAEMCAMPINAGRANDE LIVRE-SE DO MOSQUITO DA DENGUE .TRANSMISSOR DO ZIKA VÍRUS http:// WHATSAPP.8398148-3522.TEL .(03183)3055-1830/98840-0815.."
"1118","683782374065307649","2016-01-03 23:49:56","Paraíba, Brazil","-7.25","-36.5","#DEDETIZADORAEMCAMPINAGRANDE LIVRE-SE DO MOSQUITO DA DENGUE .TRANSMISSOR DO ZIKA VÍRUS http:// WHATSAPP.8398148-3522.TEL .(03183)3055-1830/98840-0815."
"1117","683786054994886656","2016-01-04 00:04:34","Ibitinga, Brasil","-21.75778","-48.82889","Nossa peguei uma dengue fdp pic.twitter.com/UUOlEe1Ipa"
"1115","683787555477819393","2016-01-04 00:10:32","Cascavel, Brasil","-24.95583","-53.45528","minha vó ta com dengue eu to bem mals"
"1114","683788351535722496","2016-01-04 00:13:41","Belo Horizonte, Brazil","-19.92083","-43.93778","o trabalho que fizemos sobre dengue semestre retrasado ta melhor que essa matéria ae"
"1113","683788499934408705","2016-01-04 00:14:17","Joinville, Brasil","-26.304440000000003","-48.84556","Até a #Dengue evolui e o Brasil só piora."
"1111","683788621716041729","2016-01-04 00:14:46","Macapá, Brazil","0.03889","-51.066390000000006","Já peguei Dengue  meu amigo a febre é horrível vc delíria."
"1110","683788832848883713","2016-01-04 00:15:36","Sao Paulo, Brazil","-23.5475","-46.636109999999995","essa vacina contra a dengue : já quero"
"1109","683789000281329664","2016-01-04 00:16:16","Sao Paulo, Brazil","-23.5475","-46.636109999999995","tem um monte de gente com caso de dengue  tenho até medo"
"1108","683789167776632834","2016-01-04 00:16:56","Salvador, Brazil","-12.971110000000001","-38.51083","Resumindo essa vacina da dengue não serve pra nada a melhor prevenção é não deixar água parada"
"1107","683789774285615111","2016-01-04 00:19:21","Goiânia, Brazil","-16.67861","-49.253890000000006","Vacinas contra dengue no fantástico."
"1106","683789982184681473","2016-01-04 00:20:10","Cabo Frio, Brasil","-22.88717","-42.02622","sou a exterminadora de dengue xD"
"1105","683790546528276481","2016-01-04 00:22:25","Nova Friburgo, Brasil","-22.28194","-42.53111","Acho q estou com dengue"
"1104","683794462775087104","2016-01-04 00:37:58","Formosa, Argentina","-26.177529999999997","-58.17814","Ya 3 personas me diagnosticaron dengue  dejen de matarme porfi"
"1103","683802836728164352","2016-01-04 01:11:15","Cariacica, Brasil","-20.3005","-40.469190000000005","Carai acho que to com suspeita de dengue"
"1102","683803619381112832","2016-01-04 01:14:21","Ferreiros, Brasil","-7.486439999999999","-35.19997","amanhã vou p praia mesmo foda-se essa dengue !"
"1101","683805134850273281","2016-01-04 01:20:23","Ibitinga, Brasil","-21.75778","-48.82889","Essas manchinhas da dengue coça pra cacete"
"1100","683810143671312384","2016-01-04 01:40:17","Guarulhos, Brasil","-23.46278","-46.53333","Assisti a reportagem sobre a vacina da dengue no fantástico e meus olhos brilharam"
"1099","683810247060897792","2016-01-04 01:40:42","Rio de Janeiro, Brazil","-22.90278","-43.2075","@gabicunhaffc @gabriellatsilva gabizinha da dengue"
"1098","683814202054701056","2016-01-04 01:56:25","Brazil","-10.0","-55.0","@MandsSelfish dengue wtf vc tá bem agr? :o"
"1095","683817234028957697","2016-01-04 02:08:27","Caxias do Sul, Brasil","-29.168059999999997","-51.17944","Coloquei no Google as dores que tô sentindo e deu que é gripe suína ou dengue ."
"1094","683819797738577920","2016-01-04 02:18:39","Itanhaém, Brasil","-24.18306","-46.78889","Tomei soro com ele quando tava com dengue nem sabia que tinha ele no fb kkkkk agora estamos amgssna verdade eu quero pegar ele"
"1093","683821276775972865","2016-01-04 02:24:31","Brazil","-10.0","-55.0","@MandsSelfish vc passou pela dengue 3x e tá se chamando de fraca? MANO"
"1092","683821784727171073","2016-01-04 02:26:32","Sao Paulo, Brazil","-23.5475","-46.636109999999995","minha vida social tão parada que daqui a pouco dá dengue ..."
"1091","683825232939999239","2016-01-04 02:40:15","Recife, Brazil","-8.053889999999999","-34.88111","Um cativeiro para mosquitos da dengue bem pertinho de nós será que a prefeitura do Recife… https://www. instagram.com/p/BAGVk56G1af/"
"1090","683828476835663873","2016-01-04 02:53:08","Manaus, Brazil","-3.1019400000000004","-60.025","Sou da época em que o Aedes Aegypti só transmitia dengue ."
"1088","683831569505714176","2016-01-04 03:05:25","Central, Paraguay","-25.339679999999998","-57.508790000000005","Puto Dengue gracias por cagarme las fiestas .l."
"1086","683833010274349056","2016-01-04 03:11:09","Sao Paulo, Brazil","-23.5475","-46.636109999999995","sabe aquela doença q vem do xixi do rato..a osteoporose ? Entao essas novas doenças n vieram do mosquito da dengue n vcs q pensam"
"1085","683833622433021952","2016-01-04 03:13:35","Rio de Janeiro, Brazil","-22.90278","-43.2075","meu wpp ta tão parado q eu tenho medo de dar dengue"
"1084","683835929086287872","2016-01-04 03:22:45","Imbé, Brasil","-29.927190000000003","-50.12826","Bora no foco da dengue"
"1082","683841462853832704","2016-01-04 03:44:44","Planalto, Brasil","-14.728620000000001","-40.38025","Me picaron mil veces los mosquitos no sé si tengo dengue  chigunkunya malaria fiebre amarilla o qué."
"1081","683842799729508356","2016-01-04 03:50:03","São Vicente, Brasil","-23.963060000000002","-46.391940000000005","Esses Jaileys shippers que estão chigando a selena precisam ser picados pela dengue pqe ninguém merece"
"1080","683848606340747264","2016-01-04 04:13:07","Ponta Porã, Brasil","-22.53611","-55.725559999999994","dem mucho mosquitos ya me picaron socorr hake dengue"
"1079","683852110933315584","2016-01-04 04:27:03","Cachoeiras de Macacu, Brasil","-22.4625","-42.653059999999996","meu wpp vai dar dengue"
"1078","683854511362977793","2016-01-04 04:36:35","Paraíba, Brazil","-7.25","-36.5","#DEDETIZADORAEMCAMPINAGRANDE LIVRE-SE DO MOSQUITO DA DENGUE .TRANSMISSOR DO ZIKA VÍRUS http:// WHATSAPP.8398148-3522.TEL .(03183)3055-1830/98840-0815"
"1076","683855174536945664","2016-01-04 04:39:13","Paraíba, Brazil","-7.25","-36.5","#DEDETIZADORAEMCAMPINAGRANDE LIVRE-SE DO MOSQUITO DA DENGUE .TRANSMISSOR DO ZIKA VÍRUS WHATSAPP.8398148-3522 pic.twitter.com/Tx6v7YmHyJ"
"1075","683859455163904002","2016-01-04 04:56:14","Sao Paulo, Brazil","-23.5475","-46.636109999999995","#DEDETIZADORAEMCAMPINAGRANDE LIVRE-SE DO MOSQUITO DA DENGUE .TRANSMISSOR DO ZIKA VÍRUS WHATSAPP.8398148-3522"
"1074","683859619891048449","2016-01-04 04:56:53","Paraíba, Brazil","-7.25","-36.5","#DEDETIZADORAEMCAMPINAGRANDE LIVRE-SE DO MOSQUITO DA DENGUE .TRANSMISSOR DO ZIKA VÍRUS WHATSAPP.8398148-3522 pic.twitter.com/0SaAjOnjvB"
"1073","683859739588038658","2016-01-04 04:57:22","Paraíba, Brazil","-7.25","-36.5","#DEDETIZADORAEMCAMPINAGRANDE LIVRE-SE DO MOSQUITO DA DENGUE .TRANSMISSOR DO ZIKA VÍRUS WHATSAPP.8398148-3522 pic.twitter.com/0Xh8hY0Fc9"
"1072","683863651212738560","2016-01-04 05:12:54","Paraíba, Brazil","-7.25","-36.5","#DEDETIZADORAEMCAMPINAGRANDE LIVRE-SE DO MOSQUITO DA DENGUE .TRANSMISSOR DO ZIKA VÍRUS WHATSAPP.8398148-3522 pic.twitter.com/8wPq1JFRWk"
"1070","683868977060298752","2016-01-04 05:34:04","Santiago del Estero, Argentina","-28.0","-63.5","A ella le gusta la picadura yo soy el dengue que la vacuna"
"1069","683871542493720578","2016-01-04 05:44:16","Rio de Janeiro, Brazil","-22.90278","-43.2075","Ter q acordar de madruga pra retocar o repelente pra n pegar umas dengue /zika/chicungunha (n sei como se escreve) #ThingsAboutRio"
"1067","683877991374569472","2016-01-04 06:09:53","Duque de Caxias, Brasil","-22.78556","-43.31167","Acho q vou pegar dengue dnv.."
"1066","683880182218883072","2016-01-04 06:18:35","Posadas, Argentina","-27.367079999999998","-55.896080000000005","@MiliGaarciaa el dengue  JAJAJAJA veni a la mia nomas no quiero morirme de dengue"
"1064","683882730216624128","2016-01-04 06:28:43","Curitiba, Brazil","-25.42778","-49.27306","a ta com dengue"
"1063","683906848093802496","2016-01-04 08:04:33","Sao Paulo, Brazil","-23.5475","-46.636109999999995","@galahxies se eu tiver com dengue rip pq já mandei 2 dorflex p dentro"
"1061","683922864840511488","2016-01-04 09:08:12","Divinópolis, Brasil","-20.14355","-44.89065","nossa na boa eu to pagando os meus pecados com essa dengue viu"
"1059","683957988944687104","2016-01-04 11:27:46","Muriaé, Brasil","-21.13056","-42.36639","A dengue me pegou de um jeito que a muito tempo nem um homem me pegava"
"1058","683966481663668224","2016-01-04 12:01:31","Curitiba, Brazil","-25.42778","-49.27306","Ah nosso Litoral... sempre é notícia... -> Dengue no Litoral do PR preocupa gestantes http://www. gazetadopovo.com.br/saude/dengue-n o-litoral-do-pr-preocupa-gestantes-2ur5pm65ibzhe17xi1uk68uza …"
"1057","683967302774185984","2016-01-04 12:04:47","Vila Velha, Brasil","-20.329720000000002","-40.2925","Ge fla fala da dengue  já q n chega nenhum reforço"
"1054","683972611274084352","2016-01-04 12:25:52","Paraguay","-23.33333","-58.0","El dengue se complica cuando hay otro tipo de enfermedad Dr. Ricardo Brassel"
"1053","683972733504516096","2016-01-04 12:26:21","Posadas, Argentina","-27.367079999999998","-55.896080000000005","(VIVO) @GalarzaGerman explica los casos sospechosos de Dengue  protocolo para determinar si la persona está o no enferma"
"1052","683973047288770560","2016-01-04 12:27:36","Paraguay","-23.33333","-58.0","Consultar ante cualquier inquietud fiebre alta dolor de huesos el dengue se manifiesta de diferentes formas Dr. Ricardo Brassel"
"1051","683973062270803968","2016-01-04 12:27:40","Londrina, Brasil","-23.31028","-51.16278","Planos devem cobrir exames para detecção de dengue e chikungunya. Saiba mais: http:// bit.ly/1JoKCHi pic.twitter.com/llULrSyW82"
"1050","683973244592984064","2016-01-04 12:28:23","Paraguay","-23.33333","-58.0","La acumulación de agua es lo más peligroso las larvas se juntan y viene el temible dengue  Dr. Ricardo Brassel"
"1049","683974008606474240","2016-01-04 12:31:25","Paraguay","-23.33333","-58.0","Combatir el dengue es cosa de todos los días Dr. Ricardo Brassel"
"1047","683974599760031744","2016-01-04 12:33:46","Mendes, Brasil","-12.16094","-42.03542","Acho q eu to com dengue"
"1046","683980753366085632","2016-01-04 12:58:14","João Alfredo, Brasil","-7.85583","-35.58833","Sobre essa dengue Q ainda não saio de mim..."
"1044","683986661785624577","2016-01-04 13:21:42","Maringá, Brasil","-23.425279999999997","-51.93861","Ano-novo velhos desafios: o combate ao mosquito da dengue http:// bit.ly/1RllcLN"
"1041","683990645476868097","2016-01-04 13:37:32","Central, Paraguay","-25.339679999999998","-57.508790000000005","Dengue del orto que me hace pasar hambre .l. quiero galletita con dulce (@Residencia González) https://www. swarmapp.com/c/k3udRulZ7sU"
"1039","683994004078391298","2016-01-04 13:50:53","Brasília, Brazil","-10.0","-55.0","mamãe sobre eu ter ido pro Lollapalooza com dengue pic.twitter.com/1jBLxx0ane"
"1038","683994556266885120","2016-01-04 13:53:04","Osório, Brasil","-29.886670000000002","-50.26972","Sonhei que eu tava na rua gritando AHHH PASSEI (na ufrgs) daí alguém batia palma pra mim... Acordei... Era a fiscalização contra a dengue"
"1037","683995144664825856","2016-01-04 13:55:25","Brasília, Brazil","-10.0","-55.0","Tira dúvidas sobre a #vacina da dengue http:// portal.anvisa.gov.br/wps/content/an visa+portal/anvisa/sala+de+imprensa/menu+-+noticias+anos/2015/tire+suas+duvidas+sobre+a+vacina+da+dengue … pic.twitter.com/xosjIIgFqJ"
"1036","684000156463853568","2016-01-04 14:15:20","Asuncion, Paraguay","-25.30066","-57.635909999999996","@780AM @MichelinOrtiz dengue arrasa en Fdo de la Mora.. A tomar conciencia. Hija mía que dios acompañe tu recuperación.."
"1035","684000361917607936","2016-01-04 14:16:09","Amparo, Brasil","-7.558889999999999","-37.03372","comecei o ano bem....iphone pifou dengue ...Já kbô 2016?"
"1033","684004379494596608","2016-01-04 14:32:06","Sao Paulo, Brazil","-23.5475","-46.636109999999995","@pecesiqueira passei as ultimos dias indo e voltando pro hospital com a minha namorada ela ta com dengue :("
"1032","684006816133574656","2016-01-04 14:41:47","Anápolis, Brasil","-16.32667","-48.95278","4 días desconectada del mundo m disfrutando la naturaleza. Mi mama desesperada llamando a Brasil pensando q me dió el dengue"
"1031","684006874639929344","2016-01-04 14:42:01","Nova Venécia, Brasil","-18.71056","-40.40056","Acho que to com dengue"
"1029","684012321908375553","2016-01-04 15:03:40","Rio de Janeiro, Brazil","-22.90278","-43.2075","A falsidade está igual à dengue : epidemia sem controle."
"1028","684012609520152576","2016-01-04 15:04:49","Formosa, Argentina","-26.177529999999997","-58.17814","Ya hay 40 casos de Dengue y nadaaa yo acá porq somos muy cojudas."
"1027","684012709004881920","2016-01-04 15:05:12","Brazil","-10.0","-55.0","NOTÍCIA | Saúde divulga dados de dengue  zika e microcefalia no estado. Zika pode chegar à Santa Maria de Jetibá - http://www. pomeranafm.com.br/saude-divulga- dados-de-dengue-zika-e-microcefalia-no-estado-zika-pode-chegar-a-santa-maria-de-jetiba-ainda-neste-verao/ …"
"1025","684013251772977152","2016-01-04 15:07:22","Copiapó, Chile","-27.36679","-70.3314","Negro conchetumadre ojala te de el dengue perro culiao https:// twitter.com/lt_deportes/st atus/684012473574359041 …"
"1024","684014788146520064","2016-01-04 15:13:28","Paraguay","-23.33333","-58.0","espero que mi papá no me obligue a ponerme la pulserita neró contra el dengue de nuevo"
"1023","684018388256075776","2016-01-04 15:27:46","Santos, Brasil","-23.960829999999998","-46.33361","Eu nunca peguei dengue . Receio que quando for picado terei dengue e todas doenças agregadas do mosquito Éder Egídio"
"1022","684018930487308289","2016-01-04 15:29:56","Brasília, Brazil","-10.0","-55.0","#SUSnaMídia | A melhor estratégia de prevenção da dengue  Zika e chikungunya está no combate ao Aedes: http:// goo.gl/N0smH2 (Via: @folha )"
"1019","684025754309492738","2016-01-04 15:57:03","Natal, Brazil","-5.795","-35.20944","vou fazer uma pergunta ao grande prefeito @carloseduardo12 os agentes da dengue tiveram teajuste em seus vales ref. e os vigias também vão?"
"1018","684026908816834562","2016-01-04 16:01:38","Belo Horizonte, Brazil","-19.92083","-43.93778","lefim teve gripe dengue  aids ta mais te atestado que trabalhando"
"1015","684028656478470144","2016-01-04 16:08:34","Fartura, Brasil","-23.38833","-49.51","Não posso estar com dengue"
"1014","684029077192323072","2016-01-04 16:10:15","Brasília, Brazil","-10.0","-55.0","Parece mais o mosquito da dengue ! kkkk"
"1013","684030897482502144","2016-01-04 16:17:29","Misiones, Argentina","-26.81427","-54.343869999999995","Tengo dengue y pido turno toda la culpa de la casa dengue de luana jajajajaja"
"1012","684031007973072896","2016-01-04 16:17:55","Rio de Janeiro, Brazil","-22.90278","-43.2075","só essa segunda-feira com suspeita de dengue mesmo"
"1011","684032356425068546","2016-01-04 16:23:17","Betim, Brasil","-19.967779999999998","-44.19833","@Alyne_Luc dengue é complicado. Você já foi no médico?"
"1010","684036027497996288","2016-01-04 16:37:52","Sao Paulo, Brazil","-23.5475","-46.636109999999995","restaurante Jardim secreto bairro perdizes fecha em férias coletiva e deixa casa com criadouros de dengue . @r7 pic.twitter.com/kuRaLf85Rn"
"1009","684036605192073216","2016-01-04 16:40:10","Sao Paulo, Brazil","-23.5475","-46.636109999999995","@R7_Portal Restaurante Jardim secreto bairro perdizes sai de férias e deixa criadouros de dengue . pic.twitter.com/6BjtorqZ3W"
"1008","684037286707748864","2016-01-04 16:42:52","Sao Paulo, Brazil","-23.5475","-46.636109999999995","@balancogeral restaurante Jardim Secreto na rua caraíbas-bairro perdizes sai de férias e deixa criadouros de dengue . pic.twitter.com/3AZ5oPPhPj"
"1007","684037498201358337","2016-01-04 16:43:43","Aparecida de Goiânia, Brasil","-16.82333","-49.24389","@BrunoSantanafer de dengue aumenta tanto em @pref_aparecida e Goiânia vamos prevenir gente"
"1006","684038206812196867","2016-01-04 16:46:31","Ribeirão Pires, Brasil","-23.71056","-46.41333","Meu whats tá tão parado que to com medo de ter dengue"
"1005","684039391061389312","2016-01-04 16:51:14","Aracaju, Brazil","-10.91111","-37.071670000000005","2016 começa e eu com suspeita de dengue"
"1004","684042262716760064","2016-01-04 17:02:38","Belo Horizonte, Brazil","-19.92083","-43.93778","Alexandre acha que tô com dengue"
"1003","684042808869662720","2016-01-04 17:04:49","Rio de Janeiro, Brazil","-22.90278","-43.2075","@maxatiada AHAHAHAHAHAHAU SÓ TEM DENGUE SOCORRO HAHAHAHAHAHAHAGAH"
"1002","684044950162550784","2016-01-04 17:13:19","Sao Paulo, Brazil","-23.5475","-46.636109999999995","@maisasilva já fui picada tantas vezes que to com medo de um deles ser o mosquito da dengue"
"1001","684051626718576640","2016-01-04 17:39:51","Formosa, Argentina","-26.177529999999997","-58.17814","ATENCIÓN! DENGUE ! pic.twitter.com/CEectXNbSQ"
"999","684054519186087936","2016-01-04 17:51:21","Juiz de Fora, Brasil","-21.76417","-43.35028","Que ótimo vim com dengue"
"998","684057246997835776","2016-01-04 18:02:11","Nova Friburgo, Brasil","-22.28194","-42.53111","Minha mãe falou que pode der dengue misericórdia!"
