"","id","date","geo","lat","long","text"
"127","688547970070016001","2016-01-17 03:26:43","Belo Horizonte, Brazil","-19.922731699999996","-43.945094700000006","Essa chuvinha é boa demais pra namorar... e minha namorada pega dengue ... =/"
"126","688549626924765184","2016-01-17 03:33:18","Angra dos Reis, Brasil","-23.0063965","-44.316325899999995","zika dengue e chikungunya @Hipnose https://www. instagram.com/p/BAn5-brkw4CG -pzE3gdszf6a3Bf-AOGX7h0itM0/ …"
"125","688549950532284416","2016-01-17 03:34:35","Ribeirão Preto, Brasil","-21.1783329","-47.806667","Essa semana acabou com eu sobre suspeita de dengue"
"124","688550212160344066","2016-01-17 03:35:37","Ribeirão Preto, Brasil","-21.1783329","-47.806667","Veio passar as férias na casa dos parentes e fico sobre suspeita de dengue"
"123","688550782023634944","2016-01-17 03:37:53","Ribeirão Preto, Brasil","-21.1783329","-47.806667","Que achou que era dengue"
"122","688552174436134913","2016-01-17 03:43:25","Ribeirão Preto, Brasil","-21.1783329","-47.806667","Se tive dengue né percebe"
"120","688556448339636224","2016-01-17 04:00:24","Porto Alegre, Brazil","-30.0329999","-51.2304999","A shana chamou a nv do Allan de mosquito da dengue"
"119","688557707520008192","2016-01-17 04:05:24","Coronel Fabriciano, Brasil","-19.520006600000002","-42.6282685","Dengue é uma coisa que não deveria existir"
"118","688559816126640128","2016-01-17 04:13:47","Coronel Fabriciano, Brasil","-19.520006600000002","-42.6282685","Tira essa dengue de mim"
"117","688560165117886465","2016-01-17 04:15:10","Coronel Fabriciano, Brasil","-19.520006600000002","-42.6282685","Você já é mimada o cúmulo da chatisse e ainda pega dengue  só seu pai pra te aguentar Obg mãe também te amo tmj"
"116","688560319996780544","2016-01-17 04:15:47","Ituporanga, Brasil","-27.4096218","-49.6014811","@maria07_eduarda então tem dengue aqui no Cerro Nego"
"115","688560774923595777","2016-01-17 04:17:36","Santo Antônio da Platina, Brasil","-23.2957156","-50.0778956","daqui uns dia a dengue faz ninho na minha vida de tao parada q ta"
"114","688561067048472576","2016-01-17 04:18:45","Itamaraju, Brasil","-17.0363102","-39.5279939","@feliipepedra flw cu de chapoca cu dr metro bunda de km seu cu é igual a dengue  qualqurt um pode pegar"
"113","688561792117792770","2016-01-17 04:21:38","Niterói, Brasil","-22.883237","-43.115455100000005","@vinny_tfc @RicaPerrone Conversou c carioca burro (a maioria). Unidade Nacional! Quer um inimigo? O mosquito da Dengue ."
"112","688572007940632576","2016-01-17 05:02:14","Sao Paulo, Brazil","-23.5506506","-46.6333823","BRN - Brazilian Researchers launching Clinical Trial For Vaccine Prevent Dengue Fever: Researchers in Brazil are… http:// dlvr.it/DJ2C8c"
"110","688576017775087616","2016-01-17 05:18:10","Unaí, Brasil","-16.3579209","-46.906018100000004","alguém que já teve dengue me ajuda oq q é bom para parar de coçar?????"
"109","688577032180072449","2016-01-17 05:22:12","Paranaguá, Brasil","-25.5121903","-48.5251853","A desgraça da porra da epidemia da Dengue que está em Paranaguá fez mais uma vítima ontem. Matou a filha do meu avô"
"108","688577703851732994","2016-01-17 05:24:52","Unaí, Brasil","-16.3579209","-46.906018100000004","quem nunca teve dengue agradeça a Deus todos os dias da vida de vocês"
"107","688578510840004610","2016-01-17 05:28:04","Contagem, Brasil","-19.913274800000003","-44.08409520000001","@ReehCarolyne miga to c dengue  nem sei quando passa"
"105","688590554771361793","2016-01-17 06:15:56","Rio de Janeiro, Brazil","-22.911013600000004","-43.2093726","Meu wpp deu dengue não é possível!"
"103","688596705122467840","2016-01-17 06:40:22","Sao Paulo, Brazil","-23.5506506","-46.6333823","BRN - NIAID Dengue Vaccine To Be Tested In 17000 Volunteers In Brazil: “Because the impact of dengue fever in… http:// dlvr.it/DJ3W4L"
"101","688598048298127360","2016-01-17 06:45:42","Juiz de Fora, Brasil","-21.7609532","-43.3501128","Cara não ter vontade de dormir e por causa da maldita possível dengue  é um saco!!! #mosquitozero :////"
"98","688602447280009218","2016-01-17 07:03:11","Posadas, Argentina","-27.366486600000005","-55.893967599999996","Creo que me acaba de picar el dengue ._."
"95","688646174220353536","2016-01-17 09:56:57","Paranaguá, Brasil","-25.5121903","-48.5251853","Ta chapado de mosquito da dengue aqui nas redondeza e eu to com um medo danado"
"93","688666602221498368","2016-01-17 11:18:07","Cordillera, Paraguay","-25.2499999","-56.99999989999999","Ministro sobre dengue  zika y chikungunya: Es una guerra de triple alianza | Dengue http://www. ultimahora.com/c959701 @CNNEE @CNN @InfobaeEEUU"
"92","688667327332765697","2016-01-17 11:21:00","Carmo, Brasil","-7.7535198","-38.7228874","Porra contrair dengue agora é foda em!"
"91","688668966345150464","2016-01-17 11:27:31","General San Martín, Argentina","-22.79346375","-63.701797813347206","Broté de Dengue en Chaco ya hay 74 casos confirmados https:// twitter.com/infobae/status /688616482775891968 …"
"88","688677763964899328","2016-01-17 12:02:28","Posadas, Argentina","-27.366486600000005","-55.893967599999996","MI WASKA PARA EL DENGUE  MI WASKA."
"87","688678847466860545","2016-01-17 12:06:46","Ponta Porã, Brasil","-22.5236896","-55.727467000000004","Depois que minha mãe teve dengue ela caça mosquito quem nem louca"
"85","688688853662756864","2016-01-17 12:46:32","Belo Horizonte, Brazil","-19.922731699999996","-43.945094700000006","O pior é que um dos mascotes lembra o Dengue da Xuxa https:// twitter.com/iodelson/statu s/688686078006550530 …"
"84","688701579998945280","2016-01-17 13:37:06","Paranaguá, Brasil","-25.5121903","-48.5251853","Pegou essa praga da dengue"
"82","688704154542407680","2016-01-17 13:47:20","Central, Paraguay","-25.4999999","-57.49999989999999","Que no sea na dengue"
"80","688705819861463041","2016-01-17 13:53:57","Posadas, Argentina","-27.366486600000005","-55.893967599999996","Todos contra el dengue . Comprar diario el territorio de joy pic.twitter.com/0SmcDjZhbg"
"79","688706254923939840","2016-01-17 13:55:41","Rio de Janeiro, Brazil","-22.911013600000004","-43.2093726","Puxa-saco e fofoqueiro são como foco de dengue : em cada esquina tem um."
"78","688710094217940993","2016-01-17 14:10:56","Elói Mendes, Brasil","-21.6094061","-45.565399400000004","aí a pessoa fala: lá em casa tinha uma dengue  põe pra procriar"
"73","688719131336687616","2016-01-17 14:46:51","Paraguay","-23.3165934","-58.1693444","@albertcabrerapy Aprovechen el calor que se pongan las pilas bacheen toda la ciudad y se eliminen los criaderos del #Dengue  @Radio970AM"
"72","688719344772186112","2016-01-17 14:47:42","Paraguay","-23.3165934","-58.1693444","@albertcabrerapy No tenemos que esperar que gente del ministerio venga a ver tu casa y la suciedad #Dengue @Radio970AM"
"70","688720621715378177","2016-01-17 14:52:46","Campo Grande, Brazil","-20.4640172","-54.616294599999996","Pq minha bisa ainda está com dengue"
"69","688722414100983812","2016-01-17 14:59:54","Pelotas, Brasil","-31.7700103","-52.3411542","É um poço p dengue  o aedes aegypti chikungunya Eu se fosse tu pegaria chikungunya pq é um nome mais chique"
"67","688727488365748224","2016-01-17 15:20:03","Resende, Brasil","-22.4686427","-44.446572700000004","@medo_b não é dengue não ne??? Se cuida Sr João."
"66","688727587384889344","2016-01-17 15:20:27","Resende, Brasil","-22.4686427","-44.446572700000004","@medo_b não é dengue não ne? Se cuida"
"64","688733965839167488","2016-01-17 15:45:48","Sao Paulo, Brazil","-23.5506506","-46.6333823","@thaidfa o médico mandou eu tomar 7 litros de água por dia quando estava com dengue"
"60","688740340283666432","2016-01-17 16:11:07","Nova Friburgo, Brasil","-22.2800003","-42.532530200000004","super desnecessário esse mosquito da dengue  praga ruim"
"57","688741736215134211","2016-01-17 16:16:40","Posadas, Argentina","-27.366486600000005","-55.893967599999996","Estoy por morir intoxicada con el coso para el dengue  fua"
"55","688744263719497729","2016-01-17 16:26:43","Valença, Brasil","-22.2461027","-43.6996916","To achando que não é dengue não em"
"52","688747896473317376","2016-01-17 16:41:09","Campo Grande, Brazil","-20.4640172","-54.616294599999996","Governo distribuirá teste único para detectar dengue  zika e chikungunya http://www. correiodopantanal.com.br/governo-distri buira-teste-unico-para-detectar-dengue-zika-e-chikungunya/ … pic.twitter.com/qQtEUWlaKK"
"51","688749309479751680","2016-01-17 16:46:46","Campo Grande, Brazil","-20.4640172","-54.616294599999996","Governo distribuirá teste único para detectar dengue  zika e chikungunya http://www. correiodopantanal.com.br/governo-distri buira-teste-unico-para-detectar-dengue-zika-e-chikungunya/ … pic.twitter.com/aLCCbQ7q7Z"
"50","688749496814166016","2016-01-17 16:47:31","Guarulhos, Brasil","-23.443060100000004","-46.5244589","Só de pensar que qdo se pega dengue não pode beber já da um medo da porra!"
"49","688751021737308160","2016-01-17 16:53:34","Carmo, Brasil","-7.7535198","-38.7228874","por um momento pensei que fosse dengue  mas é só virose mesmo"
"48","688751072979107841","2016-01-17 16:53:46","Formosa, Argentina","-24.5955305","-60.428971700000005","@todonoticias si tampoco se informa de los casos de dengue que hay en Formosa todos los medios online la misma cosa..."
"46","688751977992445952","2016-01-17 16:57:22","Misiones, Argentina","-26.7372239","-54.43152560000001","Jaja el face del dengue me comentó una foto dijo que use repelente"
"43","688756603022086144","2016-01-17 17:15:45","Curitiba, Brazil","-25.429569600000004","-49.2712361","minha coroa pego dengue ;s"
"42","688757460035842048","2016-01-17 17:19:09","Rio de Janeiro, Brazil","-22.911013600000004","-43.2093726","@NandaLopes2 seu namorado tá melhor? Dengue é coisa série"
"41","688758484700147712","2016-01-17 17:23:13","Campo Grande, Brazil","-20.4640172","-54.616294599999996","Primeira atividade depois da dengue e suei igual um condenado"
"36","688763621619400704","2016-01-17 17:43:38","Paranaguá, Brasil","-25.5121903","-48.5251853","Paranaguá é a cidade da dengue"
"35","688763885457928192","2016-01-17 17:44:41","Rio de Janeiro, Brazil","-22.911013600000004","-43.2093726","@NandaLopes2 dengue é coisa séria."
"33","688768415683710976","2016-01-17 18:02:41","Bom Jesus do Itabapoana, Brasil","-21.134102399999996","-41.68009489999999","e essa dengue que me secou? pic.twitter.com/ejOZVgLekT"
"32","688774018883825664","2016-01-17 18:24:57","Londrina, Brasil","-23.311287699999998","-51.159502200000006","Cheguei da clinica agr e tudo indica que é DENGUE :'("
"31","688774117672267776","2016-01-17 18:25:21","Londrina, Brasil","-23.311287699999998","-51.159502200000006","Dengue sua prostituta me erra vadia!!!"
"27","688777199835549696","2016-01-17 18:37:35","Manhuaçu, Brasil","-20.257443300000002","-42.0340768","Meu wpp deu dengue"
"26","688783129281179649","2016-01-17 19:01:09","Goiânia, Brazil","-16.680881900000003","-49.253269","#playoffsnaESPN estou com febre dores pelo corpo e na garganta - dengue ? Sei lá! Mas não perco os playoffs."
"25","688786190254927873","2016-01-17 19:13:19","Paraguay","-23.3165934","-58.1693444","A quienes interese; EGI- DENGUE No hay nada nuevo; muy claro! Si PY quiere inventar nueva estrategia bueh! pic.twitter.com/52Zf2umz7I"
"24","688789520477736961","2016-01-17 19:26:33","Monte Carmelo, Brasil","-18.7260938","-47.495885799999996","Como estudar com dengue pesquisar"
"23","688790037392158720","2016-01-17 19:28:36","Sao Paulo, Brazil","-23.5506506","-46.6333823","vizinho deixou um recipiente q parece ser um cinzeiro no fundo de casa. Choveu esses dias e aquilo vai virar foco de dengue e vou ser picado"
"22","688791457524793345","2016-01-17 19:34:15","São Sebastião, Brasil","-23.8027865","-45.4070526","Eu achei q era virose mas agora estou aguardando o exame pra ver se é dengue #askmagcult https:// twitter.com/carpenterrude/ status/688789611351568385 …"
"20","688797834729140225","2016-01-17 19:59:35","Brazil","-10.3333332","-53.199999899999995","Dengue  Zika and Chikungunya are all carried by the same mosquito. #Brazil"
"16","688816346969321472","2016-01-17 21:13:09","Asuncion, Paraguay","-25.2959915","-57.6311195","#HagamosNuestraParte #Dengue pic.twitter.com/yEXoLtUrmB"
"15","688816514632388608","2016-01-17 21:13:49","Barra Mansa, Brasil","-22.5394842","-44.1735128","Dengue ou zica"
"14","688818321693749248","2016-01-17 21:21:00","Porto Seguro, Brasil","-16.4424307","-39.063763","Eu acho que to com dengue cara só pode"
"13","688818907440877568","2016-01-17 21:23:19","Rondonópolis, Brasil","-16.4603532","-54.6397098","@OGlobo_Rio vamos combater a Dengue com educação. Contate a Editora: indieeditora@gmail.com"
"12","688818974335840257","2016-01-17 21:23:35","Itapecerica da Serra, Brasil","-23.7176302","-46.8492434","direto eu vejo uns mosquito esquisito aqui em casa fico com medo pq aqui em itapecerica teve registro de vários casos de dengue em 2015"
"10","688821363201699840","2016-01-17 21:33:05","Juiz de Fora, Brasil","-21.7609532","-43.3501128","Eu tenho tanta sorte Ia aplicar a prova do pism e ganhar uns 240 reais mas resolvi ficar com dengue  supeeeer legal"
"9","688827745313361921","2016-01-17 21:58:26","Central, Paraguay","-25.4999999","-57.49999989999999","Dengue : Casi 3000 criaderos eliminados en Alto Paraná | Dengue http://www. ultimahora.com/c959889 @InfobaeEEUU @cnni"
"8","688835864890359808","2016-01-17 22:30:42","Caxias do Sul, Brasil","-29.1684795","-51.179386","@DiogoJordaoS ta com dengue miga? Putz melhoras"
"7","688837398256599040","2016-01-17 22:36:48","Córdoba, Argentina","-31.417339000000002","-64.1833189","#dengue Comienza mañana un nuevo monitoreo aédico en 600 viviendas de la ciudad de Córdoba pic.twitter.com/RIIlOqvFoF"
"6","688838577225093124","2016-01-17 22:41:29","Cabo Frio, Brasil","-22.880436800000002","-42.0189226","Em casa e com Dengue Horrível ..."
"5","688847278929502208","2016-01-17 23:16:04","Monte Sião, Brasil","-2.6491641","-55.6113866","deve ser dengue certeza"
"1","688869822759854080","2016-01-18 00:45:38","Sao Paulo, Brazil","-23.5506506","-46.6333823","hoje meu wpp ficou tao parado que logo menos cria o mosquito da dengue"
"0","688871639652691970","2016-01-18 00:52:52","Mogi das Cruzes, Brasil","-23.5241171","-46.1909468","@ClubeAntiPT Aplicava na petrobras kkkkele não vai fugirisso em eurodolarah vai pegar dengue aqui na AS mesmo ou talvez Cuba.Mas Cuba ?"
"902","690686338262237188","2016-01-23 01:03:50","Rosario, Argentina","-32.9595003","-60.6615414","@GuilleLobo Guillermo si recordas Charata 2009 con Dengue . La Fundacion Mundo Sano nos dio una gran mano podes hacerles una nota"
"901","690687449463406592","2016-01-23 01:08:14","Central, Paraguay","-25.4999999","-57.49999989999999","@deichu98 vos eso no más yo estoy hecho bolsa. Tengo Dengue"
"898","690692177039638528","2016-01-23 01:27:02","General Las Heras, Argentina","-28.45627065","-65.7557911329928","Me picó algo en el cuello y mamá ya flasha dengue"
"897","690694279170281472","2016-01-23 01:35:23","Posadas, Argentina","-27.366486600000005","-55.893967599999996","Dengue : nueva protesta en la plaza central de Iguazú http:// misionescuatro.com/provinciales/d engue-nueva-protesta-la-plaza-central-iguazu/ …"
"896","690694568581406720","2016-01-23 01:36:32","Curitiba, Brazil","-25.429569600000004","-49.2712361","meu irmão pegou dengue kkkkkkkkkkkkkkkkkkkkkkkkkkkkk"
"894","690695046002253825","2016-01-23 01:38:26","Paranaguá, Brasil","-25.5121903","-48.5251853","@MartinsLeticya Sério? Mas comia cru? Como que é isso? Disseram que é muito bom pra dengue"
"892","690695809785012224","2016-01-23 01:41:28","Posadas, Argentina","-27.366486600000005","-55.893967599999996","Vecinos de Garupá conformaron una multisectorial para prevenir el dengue http:// misionescuatro.com/provinciales/v ecinos-se-garupa-conformaron-una-multisectorial-prevenir-dengue/ …"
"891","690697531400024065","2016-01-23 01:48:18","Rosario, Argentina","-32.9595003","-60.6615414","Sin Luz en Rosario.. analizando las causales d mi inminente deceso.. derretimientoafixia dengue  culatazo d caco oportunista aburrimiento"
"889","690698602478452737","2016-01-23 01:52:34","Sao Paulo, Brazil","-23.5506506","-46.6333823","Ministro da Saúde diz que país está perdendo a batalha contra a dengue . http:// folha.com.br/no1732710"
"887","690700089371811842","2016-01-23 01:58:28","Central, Paraguay","-25.4999999","-57.49999989999999","@SenepaParaguay como y dnd se pide el bloqueo para Palma Loma Luque caso de dengue confirmado?"
"886","690700382331363329","2016-01-23 01:59:38","Itapua, Paraguay","-26.8333329","-55.8333329","@julianacianfa dengue . Es la moda"
"884","690700738385833985","2016-01-23 02:01:03","Córdoba, Argentina","-31.417339000000002","-64.1833189","Por dengue  30 llamadas por día http://www. diaadia.com.ar/cordoba/por-de ngue-30-llamadas-por-dia …"
"879","690702962763657218","2016-01-23 02:09:53","Paranaguá, Brasil","-25.5121903","-48.5251853","A tia ta com dengue  dá uma dor no coração ver ela assim"
"877","690703634124967938","2016-01-23 02:12:33","Posadas, Argentina","-27.366486600000005","-55.893967599999996","me preocupa maás el dengue que milagros salas #"
"876","690703867495976961","2016-01-23 02:13:29","Posadas, Argentina","-27.366486600000005","-55.893967599999996","@RabiAndy @juliaperie @diegobranca @vividecima @pietragallahora me preocupó mas el dengue en misiones q milagro salas"
"875","690704564811603969","2016-01-23 02:16:15","Colombo, Brasil","-25.2925438","-49.2243471","Minha vó e minha melhor amiga estao c dengue  q tristeza estar longe :( :("
"874","690708256948424705","2016-01-23 02:30:55","Caruaru, Brasil","-8.2829701","-35.9722851","Passei o dia entrevada com a dengue  daí agora de noitinha o Zhou e Lixiao vieram aqui me ver  me animaram tanto"
"872","690708808960712704","2016-01-23 02:33:07","Alfenas, Brasil","-21.429740399999996","-45.947941799999995","E para ficar ótimo estou com DENGUE"
"871","690709611498881024","2016-01-23 02:36:18","Anápolis, Brasil","-16.333282699999998","-48.9525755","CONTA ISSO PRO MEU CORPO QUE TA COM DENGUE https:// twitter.com/jornalistavito r/status/690698602478452737 …"
"870","690710942028599296","2016-01-23 02:41:36","Artigas, Uruguay","-30.617075500000002","-56.93734499999999","O cara joga com Dengue"
"869","690711321990553600","2016-01-23 02:43:06","Paulista, Brasil","-7.9340068","-34.8684069","Vacina contra a dengue : Produto caro e de eficácia duvidosa http:// observatoriodaimprensa.com.br/saude-publica/ produto-caro-e-de-eficacia-duvidosa/ … via @observatorio"
"868","690711923504103426","2016-01-23 02:45:30","Duque de Caxias, Brasil","-22.7896224","-43.309928899999996","Chega alguém com dengue la e ele tomando um café kkkkkkkkkkkkkkkk"
"867","690712850004852736","2016-01-23 02:49:10","Guarulhos, Brasil","-23.443060100000004","-46.5244589","SIIIM FICAAA MINHA VÓ PEGOU DENGUE UMA VEZ VC TA COM SINTOMAS DA GRIPE? https:// twitter.com/larrysina/stat us/690711937945092096 …"
"865","690715553128955906","2016-01-23 02:59:55","Paraguay","-23.3165934","-58.1693444","@zarate045 Supongo que sí. Si los hospitales estan abarrotados de gente por el tema del dengue  no hay camas es logico que eso ocurra."
"861","690718302058995713","2016-01-23 03:10:50","Amparo, Brasil","-22.696840100000003","-46.79153929565761","acho que to com dengue ! deu ruim fds!"
"859","690719965268283392","2016-01-23 03:17:27","Goiânia, Brazil","-16.680881900000003","-49.253269","Hoje vi um ser (idiota) jogando um copo de iogurte pra fora do carro depois reclama da dengue"
"856","690724196184412161","2016-01-23 03:34:16","Misiones, Argentina","-26.7372239","-54.43152560000001","Les afectó el dengue mepa"
"852","690727851331555328","2016-01-23 03:48:47","Barra do Piraí, Brasil","-22.4703421","-43.8263235","Dengue de novo naaaao"
"849","690729397117173760","2016-01-23 03:54:56","Guaíba, Brasil","-30.1097391","-51.3153789","@vouencoxei lembrando que a dengue só ataca na luz solar na noite ela descansa como nós e depois sai para atacar e tentar matar -medo-"
"845","690732064933593089","2016-01-23 04:05:32","Entre Ríos, Argentina","-31.625284100000002","-59.3539577","Con la cantidad de mosquitos que me han picado ya estoy pasada a dengue"
"844","690732303610437636","2016-01-23 04:06:29","Ouro Preto, Brasil","-20.385169100000002","-43.5036343","Twitter tá quase proliferando misquito da dengue de tão parado"
"843","690732996962467844","2016-01-23 04:09:14","San Miguel de Tucumán, Argentina","-26.847439299999998","-65.2259153938646","Bien ahi que me esten picando todos los mosquitos que en tucuman haya alerta de dengue y no me hayan dejado despachar el off re bien ahi eh"
"839","690734473307119616","2016-01-23 04:15:06","Campo Grande, Brazil","-20.4640172","-54.616294599999996","meu pai ta enfiando na minha cabeça a noia disso ser dengue"
"838","690734534447534080","2016-01-23 04:15:20","Campo Grande, Brazil","-20.4640172","-54.616294599999996","amigo tive dengue em novembro"
"836","690736211703521280","2016-01-23 04:22:00","Itajaí, Brasil","-26.911787800000003","-48.666985100000005","O dengue  o praga ou o sorvetão https:// twitter.com/tegretol_/stat us/690724346336264192 …"
"835","690736586070347777","2016-01-23 04:23:30","San Miguel de Tucumán, Argentina","-26.847439299999998","-65.2259153938646","Le tenían miedo al ébola que nunca llegó al país pero se van felices a Brasil a recibir dengue ."
"833","690739962925465600","2016-01-23 04:36:55","Coronel Fabriciano, Brasil","-19.520006600000002","-42.6282685","Eu ja perdi ah conta de quantas vezesfico toda empoladacom está praga da dengue ainda vem acompanhadade uma tal de zica!!!!"
"832","690740623196954624","2016-01-23 04:39:32","Paranaguá, Brasil","-25.5121903","-48.5251853","Um mosquito igual da dengue me picou agora"
"831","690740702276423684","2016-01-23 04:39:51","Coronel Fabriciano, Brasil","-19.520006600000002","-42.6282685","Se a epidemia continuara presidente vai ter que anunciar mais uma bolsa....bolsa dengue pois como trabalhartodo moído e cheio de calombo ?"
"830","690740970896359424","2016-01-23 04:40:55","Santa Rosa, Argentina","-33.7101748","-61.98161629999999","Vale dice me voy a poner off por si me agarra el dengue "
"829","690743124440784896","2016-01-23 04:49:28","Merlo, Argentina","-32.3429363","-65.0138887","@mariomassaccesi en moreno ya existen 8 casos y 8 por confirmar de dengue"
"827","690745035311157248","2016-01-23 04:57:04","Guaymallén, Argentina","-32.8950718","-68.74554599999999","@valeyramaforeve ojo con el dengue"
"823","690748257148997632","2016-01-23 05:09:52","Salta, Argentina","-24.7893822","-65.41019320000001","Mi tía está re intensa con lo del dengue . Bueno por lo menos algo la va a pinchar *se iba de mambo*"
"822","690749392282849280","2016-01-23 05:14:23","Posadas, Argentina","-27.366486600000005","-55.893967599999996","@GuadaGonnzalez no ni una nube todos los dias re soleado y con 38 todos los dias por eso quiero lluvia! Pero lo feo es el dengue .."
"819","690758049150148608","2016-01-23 05:48:47","Uberlândia, Brasil","-18.918804","-48.2767836","só falta a rayssa estiver mesmo com dengue  tenho um medo disso"
"818","690759389913948160","2016-01-23 05:54:06","Salta, Argentina","-24.7893822","-65.41019320000001","El dengue avanza: en Iguazú ya se confirman 50 casos por día http:// clar.in/1S0cPro vía> http://xn--clarn-2sa.com clarín.com"
"817","690759513738231809","2016-01-23 05:54:36","San Miguel, Argentina","-28.140030600000003","-66.2025666","maté un dengue me salvé de morir gente"
"813","690766318442790913","2016-01-23 06:21:38","Guaymallén, Argentina","-32.8950718","-68.74554599999999","@SofiAbrilC dengue"
"812","690766713504337920","2016-01-23 06:23:12","Paranaguá, Brasil","-25.5121903","-48.5251853","Minha irmã está com cintomas de dengue meu Deus x\"
"811","690766783087771648","2016-01-23 06:23:29","Juquiá, Brasil","-24.3172208","-47.635561700000004","@bruna_lais mas eu to com dengue só pra avisar"
"810","690766832123408384","2016-01-23 06:23:41","Paranaguá, Brasil","-25.5121903","-48.5251853","Ta terrível essa dengue Aff que ódio desses mosquitos"
"809","690767747983261696","2016-01-23 06:27:19","Sao Paulo, Brazil","-23.5506506","-46.6333823","você pega exercito pensando que vai dar tiro e acaba tendo que combater a dengue  que merda em"
"807","690774365001097216","2016-01-23 06:53:37","Entre Ríos, Argentina","-31.625284100000002","-59.3539577","Veo un mosquito y ya flasheo dengue  ando re cagado ahre"
"806","690774970570534913","2016-01-23 06:56:01","Avellaneda, Argentina","-30.595093199999997","-64.2086788","@santiramosx para morir del dengue hay que venir al sur"
"805","690777100693983232","2016-01-23 07:04:29","Sao Paulo, Brazil","-23.5506506","-46.6333823","Ja nao basta a Dengue Zika Virus e a Chicungunha no Brasil Tinha que ter os Langersquero ver deterem essa doenca #SomosTodosCellbit"
"804","690784019596890112","2016-01-23 07:31:59","Mendoza, Argentina","-32.8897293","-68.8442955","Eu posta que me esta preocupando este temita del dengue"
"802","690788903293444096","2016-01-23 07:51:23","Rio de Janeiro, Brazil","-22.911013600000004","-43.2093726","Tava pensando aqui graças a Deus sou mt difícil de ficar doente pegar esses bgl de cachumba zika dengue e entre outros."
"801","690793266976067585","2016-01-23 08:08:43","Posadas, Argentina","-27.366486600000005","-55.893967599999996","el dengue pic.twitter.com/gla2TJ5qAE"
"796","690807721071898624","2016-01-23 09:06:09","Posadas, Argentina","-27.366486600000005","-55.893967599999996","Oh maldito mosco con dengue  culo roto a mí me fuiste a picar"
"794","690824866262597632","2016-01-23 10:14:17","Rosario, Argentina","-32.9595003","-60.6615414","Acá nos seguimos preocupando por el Dengue mientras en el primer mundo se preocupan por el zika"
