"684430520718110720","2016-01-05 18:45:26","Venezuela","8.0018709","-66.1109317","Síntomas y diferencias entre el DENGUE  CHIKUNGUNYA Y ZIKA. #SISEC #SALUD pic.twitter.com/vRMzZNThmB"
"684430140953235457","2016-01-05 18:43:56","Camboriú, Brasil","-27.02736","-48.6535656","tem uma mulher batendo palma aq na frente dizendo que é do programa da dengue ... NEGA VAZA q eu quero dormir"
"684428953377988610","2016-01-05 18:39:13","Rio de Janeiro, Brazil","-22.9110136","-43.2093726","de amor hahaha to com dengue nível 3"
"684423672975720448","2016-01-05 18:18:14","Teresina, Brazil","-5.0896402","-42.8095879","As cidades do interior do Piauí também estão envolvidos no combate ao mosquito da dengue ."
"684421904959148032","2016-01-05 18:11:12","Lajeado, Brasil","-29.4675211","-51.9626137","tem que ter muito amor ao trabalho pra se vestir com uma fantasia de mosquito da dengue  que além de tudo é quente pra cacete"
"684420004293533696","2016-01-05 18:03:39","Sao Paulo, Brazil","-23.5506506","-46.6333823","Tadinha de vovó.... Tanta gente forte pra pegar dengue  logo ela"
"684410015592112129","2016-01-05 17:23:58","Recife, Brazil","-8.064193","-34.8781516","Do jeito que eu tenho sorte vou voltar com dengue"
"684408256610058240","2016-01-05 17:16:58","Recife, Brazil","-8.064193","-34.8781516","@prefrecife qual o telefone pra informar possível foco de dengue no bairro da Várzea?"
"684403694180417536","2016-01-05 16:58:50","Porto Alegre, Brazil","-30.0329999","-51.2304999","Fica a dica aí no combate a dengue e ao zika vírus pic.twitter.com/kxuHoqbGNV"
"684402502184398850","2016-01-05 16:54:06","Brazil","-10.3333332","-53.1999999","A dengue se alastra pelo Brasil assim como o Aedes aegypti... E o que faz o governo da tia @dilmabr ? Avestruz..."
"684399090076106753","2016-01-05 16:40:33","Santa Rosa, Brasil","-27.8643545","-54.4779286","Eu acho que o vírus da dengue e os outros lá nem tão perto de santa rosa pq se chega aqui metade da cidade morre"
"684398551405871104","2016-01-05 16:38:24","Goiânia, Brazil","-16.6808819","-49.253269","Prefeitura de Goiania chegando a lenha nas multas pra quem cria mosquitos da dengue  e isso @paulogarciapt  ta certo! Quem sabe aprendem?"
"684397426199756800","2016-01-05 16:33:56","Quezon City, National Capital Region","14.6509905","121.0486155","it took 20 years for them to develop & test this new anti dengue vaccine. I hope it would turn out great."
"684397252576690176","2016-01-05 16:33:15","Santa Rosa, Brasil","-27.8643545","-54.4779286","Eu já devo ta com dengue"
"684396759414628353","2016-01-05 16:31:17","Caxias do Sul, Brasil","-29.1684795","-51.179386","Aguardando a secret. meio ambiente da @prefcaxias resolver intervir nesse ninho d mosquitos #dengue @pioneiroonline pic.twitter.com/6U98IKDn8V"
"684396592158380032","2016-01-05 16:30:37","Venezuela","8.0018709","-66.1109317","AEDES AEGYPTI ES EL MOSQUITO TRANSMISOR DEL EL DENGUE  EL CHIKUNGUÑA Y EL ZIKA #SISEC pic.twitter.com/xnFaZHyO3p"
"684396269196959746","2016-01-05 16:29:20","Barquisimeto, Venezuela","10.0740372","-69.3215666","Pero cuando hubo la epidemia de dengue y el chicunguya se les llamó y no nos hicieron caso. Y hubieron muertos."
"684395820083494912","2016-01-05 16:27:33","Campinas, Brasil","-22.9055599","-47.0608299","Ja consigo imaginar o bodao no exército lutando contra dengue"
"684394673457246208","2016-01-05 16:23:00","Belo Horizonte, Brazil","-19.9227317","-43.9450947","Vou investir em criação de mosquito da dengue"
"684393827172364288","2016-01-05 16:19:38","Quezon City, National Capital Region","14.6509905","121.0486155","taraaaayyy... clical trial na ng Anti Dengue Vaccine"
"684393483726118914","2016-01-05 16:18:16","Venezuela","8.0018709","-66.1109317","(2/2) por el virus Zika cuando existen síntomas y evitar confundirlo con dengue o chikungunya."
"684391844038455297","2016-01-05 16:11:45","Aracaju, Brazil","-10.916206","-37.0774654","To com dengue a dois dias e ja perdi 4 kilos"
"684391441804689409","2016-01-05 16:10:09","Porto Alegre, Brazil","-30.0329999","-51.2304999","Se um mosquito da dengue te picar ele morre de cirrose akdbkahdkabdkabskabdkabdoahsoa"
"684389479105323010","2016-01-05 16:02:21","Venezuela","8.0018709","-66.1109317","El virus Zika es transmitido por mosquitos en zonas tropicales. Sus síntomas son leves pero puede confundirse con dengue o chikungunya."
"684389200687398913","2016-01-05 16:01:15","Belo Horizonte, Brazil","-19.9227317","-43.9450947","Quem vai atrás de emprego com suspeita de dengue ? Eu"
"684388077943525376","2016-01-05 15:56:47","Rio Branco, Brazil","-9.9765361","-67.8220777","Prefeitura realiza limpeza e recolhimento de entulhos no combate ao mosquito da dengue http://www. jornalatribuna.com.br/?p=50383 pic.twitter.com/cXdOZpAgUt"
"684387944900259840","2016-01-05 15:56:16","Posadas, Argentina","-27.3664866","-55.8939676","Se registraron 289 casos probables de dengue en Misiones http://www. yamisiones.com/?modulo=notici a&id=90405 …"
"684384521131831296","2016-01-05 15:42:39","Sao Paulo, Brazil","-23.5506506","-46.6333823","Não aguento mais ouvir a palavra: dengue"
"684383466096558080","2016-01-05 15:38:28","São João, Brasil","-30.0051637","-51.1873548","Dengue em São João deve ser os vileiros no mínimo"
"684381438980931585","2016-01-05 15:30:24","Gerona, Central Luzon","15.6069315","120.5985733","Uso ba Dengue ? Kalamok e! Hahahaha"
"684380121982107648","2016-01-05 15:25:10","São Gonçalo, Brasil","-22.8219013","-43.0309251","Palestra para comunidade :MANEJO DA DENGUE ... ZIKA..... CHIKUNGUNYA #equipe #308 #309 @Jardim… https://www. instagram.com/p/BAKR6HfLXkj/"
"684376579439472641","2016-01-05 15:11:06","Brazil","-10.3333332","-53.1999999","A dengue matou quase 850 pessoas em 2015. 850 PESSOAS! Isso sim é epidemia."
"684371664172355584","2016-01-05 14:51:34","Nuevo Chimbote, Peru","-9.1170899","-78.5480189","La solución para evtiar el dengue es la Educacióm Preventiva. No hay otra forma. https:// twitter.com/Agencia_Andina /status/684370030415446016 …"
"684368991301832704","2016-01-05 14:40:57","Ciudad Autónoma de Buenos Aires, Argentina","-34.6075797","-58.4375796","ES DE FORMOSA Detectan el primer caso importado de dengue en Corrientes http://www. radiosudamericana.com/notix/nota/139 521_detectan_el_primer_caso_importado_de_dengue_en_ccorrientes.htm … pic.twitter.com/NDupygJEnz"
"684368742495682560","2016-01-05 14:39:57","Sao Paulo, Brazil","-23.5506506","-46.6333823","Acúmulo de Lixo na Rua Francisco Barreto235 Jd. Primavera SP. Providências urgente! Cuidado com a Dengue #todoscontraadengue @gnatalini"
"684368294309007360","2016-01-05 14:38:10","Makati City, National Capital Region","14.5568853","121.023532","Fuck! Ang sakit ng likod ko! Bkt ngaun pa?! Dto ngcmla dengue nun eh. Damnnn!!!"
"684367486448447489","2016-01-05 14:34:58","Recife, Brazil","-8.064193","-34.8781516","[ #JCNasRuas ] Omissão do poder público contribui para proliferação de mosquito da dengue » http:// goo.gl/VIClfh pic.twitter.com/LUzZ7k8v5t"
"684367343565324289","2016-01-05 14:34:24","Rio de Janeiro, Brazil","-22.9110136","-43.2093726","@LeiSecaRJ @MylenaDoRio Foco de dengue ... E se vc reclamar eles ainda dizem q vc é contra o favelado!"
"684367232474820608","2016-01-05 14:33:57","Muntinlupa City, National Capital Region","14.3894091","121.0475399","Dengue vaccine cancer next please and or hiv/aids"
"684364155776839680","2016-01-05 14:21:44","Iaras, Brasil","-22.8742566","-49.1593922","Campanha de combate a dengue !"
"684362308370436096","2016-01-05 14:14:23","Corrientes, Argentina","-27.4720341","-58.8328657","68 casos de leishmaniasis ahora dengue  todas enfermedades que se podrían prevenir con limpieza. Pero no... mejor hablemos de carnaval"
"684356673293697024","2016-01-05 13:52:00","Ubá, Brasil","-21.1199999","-42.9427769","Mais essa porra de dengue ta pegando todo mundo"
"684356605291421696","2016-01-05 13:51:44","Ubá, Brasil","-21.1199999","-42.9427769","Minha vozinha ta com dengue tadinha"
"684355158348840961","2016-01-05 13:45:59","Posadas, Argentina","-27.3664866","-55.8939676","Martínez: Pelear y luchar contra el dengue no se hace sólo cuando hay un caso se debe hacer los 365 días del año"
"684353827504558081","2016-01-05 13:40:41","Posadas, Argentina","-27.3664866","-55.8939676","Sin recolección Centenario casi San Martin casas limpias x dengue y con esto q hacemos @muniposadas @losadajoaquin pic.twitter.com/6fPwOnjWKu"
"684353382904037376","2016-01-05 13:38:55","Santos, Brasil","-23.9608329","-46.3338889","@folha Já imaginaram?..Começar um novo mundo já habitado por BARATAS! ..Ninguém merece!..Leva o mosquito da dengue também..é mais resistente"
"684351095410429953","2016-01-05 13:29:50","São José dos Campos, Brasil","-23.180501","-45.8872968","Acordei cm a mulher da dengue chamando"
"684350567485931520","2016-01-05 13:27:44","Brasília, Brazil","-10.3333332","-53.1999999","País tem alta de dengue e 2015 acumula 158 milhão de casos http://www. correiodopantanal.com.br/pais-tem-alta- de-dengue-e-2015-acumula-158-milhao-de-casos/ … pic.twitter.com/d2mC7ASEGV"
"684349617174102016","2016-01-05 13:23:57","Formosa, Argentina","-24.5955305","-60.4289717","Prevención #Dengue pic.twitter.com/FvvM89W5TI"
"684349548794363905","2016-01-05 13:23:41","Formosa, Argentina","-24.5955305","-60.4289717","Prevención #Dengue pic.twitter.com/oiOb83hlk0"
"684349305700925441","2016-01-05 13:22:43","Formosa, Argentina","-24.5955305","-60.4289717","Prevención #Dengue pic.twitter.com/V9z95GdEFM"
"684349293399031808","2016-01-05 13:22:40","Paraguay","-23.3165934","-58.1693444","El rociado es una última medida contra el mosquito del dengue  lo principal es la limpieza Lic. Martha Torales SENEPA #R800AM"
"684347607896952832","2016-01-05 13:15:58","Paraguay","-23.3165934","-58.1693444","En comunicación con la Lic. Martha Torales Directora Técnica del SENEPA sobre brotes de dengue en departamentos del país #R800AM"
"684346786664808448","2016-01-05 13:12:43","Posadas, Argentina","-27.3664866","-55.8939676","(VIVO) Dengue : problemas para conseguir repelentes para bebés. Hay en súper de Villa Cabello. Caros los p/flías en farmacias"
"684346182852722688","2016-01-05 13:10:19","National Capital Region, Republic of the Philippines","14.5736108","121.0329706","dengue vaccine tf"
"684345247657275392","2016-01-05 13:06:36","Posadas, Argentina","-27.3664866","-55.8939676","(VIVO) @GalarzaGerman y @ajonatantavares c/ informes sobre accidentados en Brasil y el informe provincial del Dengue pic.twitter.com/Oq0EjVBail"
"684343421981585408","2016-01-05 12:59:20","Sao Paulo, Brazil","-23.5506506","-46.6333823","Dengue avança antes do verão e 2015 acumula 158 milhão de casos http:// oesta.do/1O2mV6A"
"684342230031663104","2016-01-05 12:54:36","Posadas, Argentina","-27.3664866","-55.8939676","(AHORA) Dengue : hay 289 casos sospechosos en Misiones. El 85% de las personas estuvieron en zonas endémicas. Parte de Salud Pública"
"684340188710047744","2016-01-05 12:46:30","Dominican Republic","19.0974031","-70.3028025","Hay múltiples factores que provocan la aparición del mosquito del dengue y así mismo las enfermedades” #NelsonMonegro #EnfoqueMatinal"
"684338949511315456","2016-01-05 12:41:34","Bogotá, D.C., Colombia","4.63874255","-74.085237657545","EN 2016 SE ESPERA ARREMETIDA DEL DENGUE http:// tuperfil.net/en-2016-se-esp era-una-arremetida-del-dengue/ … pic.twitter.com/wc7jx7Sr63"
"684338696573825024","2016-01-05 12:40:34","Ciudad Autónoma de Buenos Aires, Argentina","-34.6075797","-58.4375796","Hay Alto riesgo de una epidemia de dengue en Paraguay http://www. yamisiones.com/?modulo=notici a&id=90355 … …"
"684338693734273024","2016-01-05 12:40:33","Recife, Brazil","-8.064193","-34.8781516","[ #JCBrasil ] País tem alta de dengue antes do verão e 2015 acumula 158 milhão de casos » http:// goo.gl/ynqPo5 pic.twitter.com/bsFEKzoWyb"
"684335612674093056","2016-01-05 12:28:19","Ciudad Autónoma de Buenos Aires, Argentina","-34.6075797","-58.4375796","ALERTA SOBRE TODO A LOS QUE VIAJARÁN A BRASIL Instan a la comunidad a acentuar las medidas de prevención del dengue http://www. elliberal.com.ar/ampliada.php?I D=231103 …"
"684334833305272325","2016-01-05 12:25:13","Rio de Janeiro, Brazil","-22.9110136","-43.2093726","Até que estar com dengue tem suas vantagens pic.twitter.com/Ob5H9ahCwE"
"684333900898766848","2016-01-05 12:21:30","Olongapo City, Central Luzon","14.8314675","120.2835205","Dengue Vaccine!!!!! yaaay for that!"
"684332304228085760","2016-01-05 12:15:10","Posadas, Argentina","-27.3664866","-55.8939676","(VIVO) @emiliodarioN6 señala que hay especulación con los repelentes ante la demanda por Dengue"
"684331991542706176","2016-01-05 12:13:55","Ciudad Autónoma de Buenos Aires, Argentina","-34.6075797","-58.4375796","Lo mínimo q te puede pasar si vas a la costa en estos momentos es q te pique el dengue"
"684330466636378112","2016-01-05 12:07:52","Ferreiros, Brasil","-7.4496669","-35.2426003","Foi Tia Ivonete Mainha Tio José Tia Anunciada Vovó e Agora Thais dengue Do Cão."
"684328195429122048","2016-01-05 11:58:50","Batu, Selangor","3.0694761","101.5574374","Dengue (@Hospital Sungai Buloh in Sungai Buloh Selangor) https://www. swarmapp.com/c/cJV2ZTOqRPw pic.twitter.com/Cy0xooOjqi"
"684323141514969088","2016-01-05 11:38:45","Davao City, Davao Region","7.06126355","125.60807109126","@piacayetano @govph good news to most people but very sad dev't for MD like me who's child died of dengue shock syndrome it's too late"
"684322674642792449","2016-01-05 11:36:54","Damansara, Selangor","3.13752","101.5966339","@Anwar_zahari dengue"
"684318887639412736","2016-01-05 11:21:51","Asuncion, Paraguay","-25.2959915","-57.6311195","@AsuncionMuni hace 1sem q no llevan la basura3 personas con dengue ya somos! Barrio C. Nueva vengan urgente!!"
"684314181806374912","2016-01-05 11:03:09","Iloilo City, Western Visayas","10.702427","122.5690318","@futahamnida hahaha pa dengue mn kaya ako para kauli jk. Halong yang. Get well soon"
"684313558759399424","2016-01-05 11:00:40","Rio de Janeiro, Brazil","-22.9110136","-43.2093726","Dengue avança e total de casos em 2015 chega a 158 milhão. (Estadão)"
"684311737387085824","2016-01-05 10:53:26","Asuncion, Paraguay","-25.2959915","-57.6311195",".. inundaciones más dengue ! vamos mi PARAGUAY que salimos de estas https:// twitter.com/CadaDiaSNT/sta tus/684311388290977792 …"
"684299418221285376","2016-01-05 10:04:29","Vargem Alegre, Brasil","-18.8311868","-40.8503193744951","Tudo indica ser dengue .. Af"
"684299268623085568","2016-01-05 10:03:53","Curitiba, Brazil","-25.4295696","-49.2712361","Pensei até que fosse dengue"
"684297909836333056","2016-01-05 09:58:30","Perak, Pahang","4.6057452","101.1127226","Hopefully bukan dengue (@Hospital Sultan Haji Ahmad Shah Temerloh in Temerloh Pahang) https://www. swarmapp.com/c/0STtPVvLjK7"
"684295923921453056","2016-01-05 09:50:36","Sao Paulo, Brazil","-23.5506506","-46.6333823","@gnatalini Bom Dia! No verão cuidados maiores com a Dengue : Siga as Orientações: http:// natalini.com.br"
"684285569656946688","2016-01-05 09:09:27","Bahamas","24.7736546","-78.0000546","Sumn bite my back now I feel sick hope dis ain dengue"
"684279313756241920","2016-01-05 08:44:36","Corrientes, Argentina","-27.4720341","-58.8328657","@Torres_Gia @RocioFz_Ok Por que tenes dengue nomas?"
"684242706802016258","2016-01-05 06:19:08","Salta, Argentina","-24.7893822","-65.4101932","SALTA Emitieron un alerta tras el primer caso de dengue http://www. eltribuno.info/c659492 vía> http:// eltribuno.info"
"684234746424066048","2016-01-05 05:47:30","Posadas, Argentina","-27.3664866","-55.8939676","@alcarazagus15 @lu_esteche @FloreenPereira @FlorenciaDaCru1 @Carolin84933239 LA NEGRA NO TIENE DENGUE  el sábado pinta cheboli. Ampliaremos"
"684234223302094848","2016-01-05 05:45:25","Posadas, Argentina","-27.3664866","-55.8939676","Por suerte la negra no tiene dengue"
"684233587923660800","2016-01-05 05:42:54","Los Olivos, Peru","-18.2087787","-70.5128143","@Reliefzero De allí nació el Dengue :v"
"684231702043070464","2016-01-05 05:35:24","Londrina, Brasil","-23.3112877","-51.1595022","tt ta mais parado que água de dengue"
"684230778952257536","2016-01-05 05:31:44","São Lourenço, Brasil","-22.1163889","-45.0541669","Minha dm tá mais parada que água de dengue KKKKKKKKKK"
"684230233705299969","2016-01-05 05:29:34","Curitiba, Brazil","-25.4295696","-49.2712361","Minha mãe não quer deixar eu ir pra Praia por causa da dengue"
"684229353950044160","2016-01-05 05:26:05","Valparaíso, Chile","-33.0458455","-71.6196748","Dengue"
"684225891723939841","2016-01-05 05:12:19","Quezon City, National Capital Region","14.6509905","121.0486155","1.07 million students to get dengue vaccine – DOH. http://www. rappler.com/nation/117954- ph-students-dengue-vaccine-doh?utm_content=buffer94f9c&utm_medium=social&utm_source=facebook.com&utm_campaign=buffer … pic.twitter.com/e7Kz0693Kr"
"684223529483694080","2016-01-05 05:02:56","Posadas, Argentina","-27.3664866","-55.8939676","Brote de dengue en Posadas y salud pública desmiente"
"684220865379184640","2016-01-05 04:52:21","Manaus, Brazil","-3.1319514","-59.9864061","Cara não sei diferenciar o mosquito da dengue . Se algum me ferrar deu zica! LITERALMENTE"
"684219553375719424","2016-01-05 04:47:08","Recife, Brazil","-8.064193","-34.8781516","acho que vou pegar dengue pq a quantidade de mosquito nessa sala nao ta normal e eu to com preguiça de ir pro meu quarto"
"684218338197803008","2016-01-05 04:42:18","Brazil","-10.3333332","-53.1999999","me manda uma dengue mas não deixa meu filho doentinho por favor"
"684216203217362944","2016-01-05 04:33:49","Corrientes, Argentina","-27.4720341","-58.8328657","''ojala te pique el dengue o te coma una anaconda'' que buena novia sres"
"684215953442377728","2016-01-05 04:32:50","Dois Vizinhos, Brasil","-25.746468","-53.0554368","@talissadoria @becapaluti ingredientes caldeirão bichinho q tentou me asfixiar mosquito da dengue sal do himalaia e cachaça de jambu"
"684214091020275712","2016-01-05 04:25:26","Quezon City, National Capital Region","14.6509905","121.0486155","Street lamps tackle dengue by luring mosquitoes with fake human scent. http://www. theguardian.com/global-develop ment/2016/jan/02/street-lamps-dengue-fever-mosquitoes-malaysia … pic.twitter.com/nFIRh1MiHg"
"684213422049914880","2016-01-05 04:22:46","Sao Paulo, Brazil","-23.5506506","-46.6333823","Eu emagreci com a dengue e meus peitos também diminuíram muito de tamanho socorro nem parecem os mesmos"
"684212886219132933","2016-01-05 04:20:38","São Gonçalo, Brasil","-22.8219013","-43.0309251","Minha vida amorosa tá igual água de dengue"
"684212499873460225","2016-01-05 04:19:06","Valencia, Venezuela","10.1828036","-68.0035529","@trafficVALENCIA no paran bolas las autoridades por el dengue en ka Trigaleña resp. Comuna  alcaldia  gobernacion  malarialogia parasitos"
"684208049620414466","2016-01-05 04:01:25","Piranguinho, Brasil","-22.4029371","-45.5338951","Minha vida sexual tá parada igual água pra dengue"
"684206506275901440","2016-01-05 03:55:17","Cabo de Santo Agostinho, Brasil","-8.2838944","-35.0320983","to com medo de pegar dengue dnv"
"684204488954114049","2016-01-05 03:47:16","Rio de Janeiro, Brazil","-22.9110136","-43.2093726","A praga da dengue me pegou mas uma vez .."
"684203750572093440","2016-01-05 03:44:20","Recife, Brazil","-8.064193","-34.8781516","@keellymartins miga cuidado c dengue"
"684202470268993536","2016-01-05 03:39:15","Kuala Lumpur Federal Territory, Malaysia","3.97822225","101.982001451837","Wow this is the 6th times i've been suspect Dengue up until this new year. Thanks Good Girl Aedes."
"684199678712266752","2016-01-05 03:28:09","Central Visayas, Republic of the Philippines","10.30231135","123.996810486359","..Tnx God i'm back...been in the hospital for days..my son got dengue .dami ko tuloy na mis..Morning Friends!!"
"684198937717293059","2016-01-05 03:25:13","Buenos Aires, Argentina","-34.6075797","-58.4375796","Y se suspende el viaje a Paraguay x culpa del dengue"
"684196144059121665","2016-01-05 03:14:07","Rio de Janeiro, Brazil","-22.9110136","-43.2093726","@apindols teve febre? Ele teve mas passou rápido e não deixou ele incapacitado. Dengue deixa."
"684196111226122240","2016-01-05 03:13:59","Ciudad Autónoma de Buenos Aires, Argentina","-34.6075797","-58.4375796","#YoTeAvise Emitieron un alerta tras el primer caso de dengue http://www. eltribuno.info/emitieron-un-a lerta-el-primer-caso-dengue-n659492 … pic.twitter.com/dUFmxV077b"
"684195455807389697","2016-01-05 03:11:23","Ciudad Autónoma de Buenos Aires, Argentina","-34.6075797","-58.4375796","Sudamérica busca frenar el avance del dengue con la flamante vacuna de Sanofi http:// miradaprofesional.com/ampliarpagina. php?id=1645&npag=3#.VosmIFJRKDk …"
"684195208741949441","2016-01-05 03:10:24","Brazil","-10.3333332","-53.1999999","@bwnca ah ta dor no olho é dengue sinto muyito"
"684194177295466496","2016-01-05 03:06:18","Rancharia, Brasil","-22.2269099","-50.8930409","@bwnca mas sério se tu tá sentindo isso é tá com suspeita de q seja dengue vê se tu vai no medico hospital posto etc logo"
"684192136024162304","2016-01-05 02:58:11","Belo Horizonte, Brazil","-19.9227317","-43.9450947","2016 já começou bem minha família toda com dengue e só eu escapei. Obgd vida (ou não)."
"684186456848515072","2016-01-05 02:35:37","São Bernardo do Campo, Brasil","-23.690102","-46.5629623","meu whats vai pegar dengue"
"684186297385222144","2016-01-05 02:34:59","Dominican Republic","19.0974031","-70.3028025","Moradores del Residencial Antonia y Arroyo Bonito en Manoguayabo denunciaron existencia de brote de dengue en esa zona #EnfoqueFinal #NCDN"
"684185889568866304","2016-01-05 02:33:22","Bogotá, D.C., Colombia","4.63874255","-74.085237657545","EN 2016 SE ESPERA ARREMETIDA DEL DENGUE http:// tuperfil.net/en-2016-se-esp era-una-arremetida-del-dengue/ … pic.twitter.com/1hoioCYDdl"
"684181368889307136","2016-01-05 02:15:24","Ipatinga, Brasil","-19.4777806","-42.5270801","Dengue não é de Deus"
"684180099265105920","2016-01-05 02:10:21","Rio de Janeiro, Brazil","-22.9110136","-43.2093726","eu com dengue em casa enquanto as migas: pic.twitter.com/OTxyUG91Xs"
"684178419102400512","2016-01-05 02:03:41","Rio de Janeiro, Brazil","-22.9110136","-43.2093726","to com dengue e sem apetite nenhum mas comendo muita besteira pra deixar a vida um tiquinho melhor"
"684173572005298177","2016-01-05 01:44:25","Ponta Porã, Brasil","-22.5236896","-55.727467","Y la gorda esta con dengue (@Policlinica IPS PJC) https://www. swarmapp.com/c/2BlFJQXL4Xw"
"684170168428294144","2016-01-05 01:30:54","Venezuela","8.0018709","-66.1109317","En Aragua esta sonando una epidemia como el dengue o peor y no consigues un repelente aunque se para los niños y ellos que?"
"684169545586704385","2016-01-05 01:28:25","Savannah, GA","32.0835407","-81.0998341","@eduardojurekk pow migo fica assim não. Ce Ta europa. Podia estar no Brasil fugindo de dengue . Ta hazando"
"684167312602173441","2016-01-05 01:19:33","Pomerode, Brasil","-26.7356217","-49.1770094","@eugenioleal uma espécie de Conca depois da dengue"
"684164645385560064","2016-01-05 01:08:57","Brazil","-10.3333332","-53.1999999","@m_peiter Se um mosquito da dengue te picar ele morre de cirrose é só tu assistir kkkkkkkkkkkkkkk"
"684163748093923328","2016-01-05 01:05:23","Posadas, Argentina","-27.3664866","-55.8939676","Que pesada mi vieja con el dengue ."
"684163402277715968","2016-01-05 01:04:00","Cosmópolis, Brasil","-22.6437397","-47.1972085","Minha mãe acha que está com dengue de novo"
"684161099118329857","2016-01-05 00:54:51","Niterói, Brasil","-22.88333","-43.10361","@bruavianna vai voltar sexta ne? To c dengue mas até la ja to boa"
"684157977037778944","2016-01-05 00:42:27","São José do Rio Preto, Brasil","-20.8166","-49.4065","Meu wathsap tá mais parado que dengue"
"684157014658924545","2016-01-05 00:38:37","Puerto Presidente Stroessner, Paraguay","-25.50972","-54.61111","el dengue baja de peso?"
"684156961399652352","2016-01-05 00:38:25","Campinas do Sul, Brasil","-27.70629","-52.63937","To resfriada mas estou agindo como se fosse dengue"
"684155976057024514","2016-01-05 00:34:30","Canoas, Brasil","-29.91778","-51.18361","@PatricBonini o mosquito pica na pessoa a pessoa fica inchada ooooo Patric tu cuida essa dengue"
"684154284020228097","2016-01-05 00:27:46","Brasília, Brazil","-10.0","-55.0","To com dor atrás dos olhos medo de ser Dengue não quero morrer"
"684153197309636608","2016-01-05 00:23:27","Ubatuba, Brasil","-23.43389","-45.07111","Meu whatsapp está quase dando dengue de tão parado que está"
"684153194377834496","2016-01-05 00:23:27","Venezuela","8.0","-66.0","A mi no me ha dado ni dengue  ni chikungunya ni paludismo ni zica nada de eso"
"684152362706071553","2016-01-05 00:20:08","Rio de Janeiro, Brazil","-22.90278","-43.2075","Tenho certeza que fui picada por um mosquito da dengue . Será que eu já to com dengue ?"
"684150630387200004","2016-01-05 00:13:15","Posadas, Argentina","-27.36708","-55.89608","En Paraguay esta lleno de gente con dengue y acá igual  encima hay casos cerca de casa. Que feo Diosss."
"684148693499523072","2016-01-05 00:05:34","Peru","-10.0","-75.25","Verano 2016 Piscinas caseras podrían convertirse en nido d/zancudo del #dengue @diariocorreo http:// goo.gl/zL0vE2 pic.twitter.com/JZY9WllZAE"
"684143967601070081","2016-01-04 23:46:47","Sao Paulo, Brazil","-23.5475","-46.63611","just out here trying 2 not get dengue fever"
"684139484003340288","2016-01-04 23:28:58","Brazil","-10.0","-55.0","Estou com tanta picada de pernilongo nas pernas que se eu não peguei dengue é um milagre"
"684136685005844481","2016-01-04 23:17:51","Guaratinguetá, Brasil","-22.81639","-45.1925","acho que to com dengue não e possível pqp"
